Cloth_Desc,Price
SHEIN Unity Solid Form Fitted Bodysuit,8.35
Cherry Embroidery Lantern Sleeve Cardigan,19.0
Random Allover Floral Print Ruched Bust Ruffle Hem Cami Dress,17.0
SHEIN SXY Cut Out Waist Tube Bodycon Dress,9.0
Solid Drawstring Slant Pocket Sweatpants,13.4
Ring Linked Triangle Thong Bikini Swimsuit,8.0
Leather Look Zipper Fly Flare Leg Jeans,22.4
3pack Random Tropical Print Halter Drawstring Side Bikini Swimsuit,12.6
O-ring Detail Textured Bikini Swimsuit,12.0
Letter Graphic Drop Shoulder Thermal Pullover,9.49
Solid Ribbed Crop Tank Top,8.49
Solid Ruched Side Pencil Hem Tank Dress,13.0
Ditsy Floral Ring Linked Triangle Bikini Swimsuit,8.49
Solid Ruched Stacked Skinny Jeans,23.4
SHEIN SXY Scoop Neck Unitard Jumpsuit,15.0
Contrast Binding Halter Triangle Bikini Top,5.49
SHEIN ICON Tie Backless Ruched Halter Jumpsuit,18.0
Plain Halter Micro Triangle Bikini Swimsuit,8.0
Heart Pattern Drop Shoulder Sweater,20.0
SHEIN SXY Lace Trim Hook & Eye Cami Top,14.4
SHEIN SXY Split Hem Tube Dress,11.0
SHEIN Modely Houndstooth Shoulder Pads Mock Neck Bodycon Dress,5.75
Shirred Bodice Allover Print Jumpsuit Without Belt,14.0
Zipper Fly Flap Pocket Cargo Jeans,28.0
Ditsy Floral Flounce Sleeve Blouse,8.0
Triangle Tie Side Bikini Swimsuit,8.49
Plain Knot Kimono,7.0
EMERY ROSE Crisscross Backless Wide Leg Cami Jumpsuit,14.0
Keyhole Back Halter Bodycon Dress,13.0
SHEIN SXY Solid Backless Crop Tank Top,5.49
Colorblock Contrast Collar Blouse,11.0
SHEIN Bell Sleeve Knot Front Crochet Kimono,6.49
Two Tone Contrast Binding Tie Backless Halter Triangle Bikini Top,7.0
Notch Neck Rib-knit Tank Top,4.49
Textured Knit Duster Cardigan,18.0
EMERY ROSE Color Block Lantern Sleeve Blouse,9.0
SHEIN SXY Lapel Neck Single Breasted Blazer,22.4
SHEIN BASICS Drop Shoulder Zipper Up Hooded Sweatshirt,15.0
SHEIN BASICS Solid Mock Neck Crop Top,3.85
DAZY Button Up Drop Shoulder Shirt,18.0
SHEIN ICON Solid PU Leather Crop Cami Top,4.0
SHEIN EZwear 3pcs Solid Backless Cami Romper,18.0
SHEIN MOD Twist Front Wide Strap Top,5.49
Rib Halter Triangle Tie Side Bikini Swimsuit,8.49
SHEIN EZwear Star Pattern Distressed Drop Shoulder Sweater,10.7
Allover Print Underwire Bikini Swimsuit,8.48
4pcs Solid Ribbed Knit Bodysuit,25.4
Floral Print Off Shoulder Lantern Sleeve Knot Front Blouse,13.0
Plain Cut-out Bikini Swimsuit,11.0
Flutter Sleeve Belted Dress,9.98
SHEIN SXY Puff Sleeve Double Button Blazer & Pants,31.0
Car & Letter Graphic Drop Shoulder Tee,8.0
Sleeveless Zip Up Crop Vest Puffer Coat,17.0
Textured One Shoulder Bikini Swimsuit,11.0
ROMWE Slogan Cartoon Graphic Oversized Tee,10.4
SHEIN EZwear V Waist Flare Leg Pants,15.0
Sheer Asymmetrical Hem Cami Top,6.49
SHEIN ICON Ribbed Knit Crop Tank Top,5.0
Ditsy Floral Halter Triangle Bikini Swimsuit,8.49
SHEIN ICON Twist Front Cut Out Ruched Bodycon Dress,8.0
Solid Crisscross Tie Back Crop Top,5.49
EMERY ROSE Grid Print Notched Neckline Blouse,6.0
Two Tone Twist Front Crop Tank Top,5.49
SHEIN SXY Solid High Cut Zipper Bodysuit,9.49
SHEIN ICON Flap Pocket Side Cargo Pants,30.4
SHEIN EZwear Notched Neck Rib Knit Unitard Romper,9.0
Tank Top & Split Thigh Skirt,13.0
SHEIN EZwear Striped Print Crop Cami Top,4.0
Two Tone Tie Back Triangle Thong Bikini Swimsuit,11.0
Colorblock Pointelle Knit Drawstring Hooded Cardigan,20.4
Solid Tank Top,5.49
SHEIN BAE Square Neck Unitard Romper,10.0
Color Block Ribbed Knit Tank Top,5.49
Fluid Smocked Halter Triangle Bikini Swimsuit,10.4
Knot Waist Cover Up Skirt,7.0
SHEIN SXY Zipper Up Funnel Collar Winter Coat,26.4
Guipure Lace Panel Blouse,7.0
High Waist Ripped Raw Trim Denim Shorts,13.4
SHEIN ICON Boat Neck Crop Top,7.0
SHEIN MOD Ruched Square Neck Crop Top,7.0
SHEIN Tall Square Neck Lantern Sleeve Ruched Bodycon Dress,13.0
Floral Print Flounce Sleeve Blouse,12.4
Allover Floral Knot Split Thigh A-line Dress,17.0
Allover Print Notched Neck Bishop Sleeve Blouse,11.0
Colorblock Wrap Hem Belted Cami Dress,20.0
Solid Cut Out Side Tank Top,7.0
Striped Smocked Halter Triangle Bikini Top,6.49
Textured Underwire High Cut Bikini Swimsuit,12.0
Leopard Frill Trim Tie Side Bikini Swimsuit,10.4
SHEIN SXY Textured One Shoulder Cut Out Bodycon Dress,14.0
High Waist Bleach Wash Ripped Skinny Jeans,16.4
High Waist Patch Detail Raw Cut Flare Leg Jeans,25.0
Ditsy Floral Flounce Sleeve Blouse,7.49
Graphic Print Button Front Shirt,8.49
SHEIN EZwear Solid Cami Unitard Jumpsuit,10.0
SHEIN BAE Square Neck Asymmetrical Hem PU Tank Top,5.49
SHEIN BIZwear Solid Notch Neck Blazer,10.9
Ditsy Floral Twist Front Split Hem Dress,15.0
Solid Mock Neck Puff Sleeve Blouse,12.4
Allover Print High Waisted Bikini Swimsuit,12.0
Criss Cross Front Halter Top,10.4
SHEIN VCAY Ditsy Floral Draped Belted Cami Dress,8.0
Lantern Sleeve Keyhole Back Blouse,8.49
Open Front Kimono,10.4
SHEIN SXY Solid Textured Crop Tank Top,7.0
Dalmatian Print Layered Butterfly Sleeve Blouse,7.0
Plaid Shawl Collar Open Front Blazer,29.0
Glitter Triangle Tie Side Bikini Swimsuit,10.0
90s Floral & Letter Graphic Crop Tank Top,5.49
SHEIN EZwear Drawstring Detail Super Crop Hoodie,9.49
Striped Textured Bandeau Bikini Swimsuit,11.4
EMERY ROSE Hidden Pocket Fold Pleated Detail Pinafore Jumpsuit Without Tee,18.4
Lace-up Front Backless Textured Crop Halter Top,7.0
Plain V Neck Bikini Swimsuit,11.0
SHEIN Unity Tie Back Hanky Hem Cami Top,4.0
SHEIN VCAY Color Block Stripe Pattern Crop Pointelle Knit Sweater,15.0
SHEIN PETITE Zipper Fly Seam Front Split Hem Flare Leg Pants,17.0
Two Tone Drop Shoulder Striped Trim Sweater,19.0
Gold Argyle Print Notched Neck Batwing Sleeve Blouse,8.0
SHEIN BAE Draped Cut Out Crisscross Tie Backless Satin Cami Dress,12.0
Feather Print Notched Neck Bishop Sleeve Blouse,8.49
SHEIN X Aurora Celli Solid PU Leather Straight Leg Pants,20.0
Floral Print Lantern Sleeve Belted Dress,20.0
Rib Knot Side Triangle Bikini Swimsuit,8.49
SHEIN EZwear Solid High Waist Leggings,8.49
Solid Zip Up Drawstring Thermal Lined Hoodie,11.3
Color Block Drop Shoulder Sweater,15.0
SHEIN SXY Solid Mock Neck Unitard Jumpsuit,12.4
Flutter Sleeve Belted Dress,9.98
SHEIN ICON Twist Split Hem Tube Top,6.0
EMERY ROSE Contrast Dobby Mesh Raglan Sleeve Blouse,4.0
Lace Bustier Crop Cami Top,5.98
Ditsy Floral Notched Neck Flounce Sleeve Blouse,11.4
Raw Hem Distressed Denim Shorts,14.4
SHEIN PETITE Solid High Waist Leggings,6.0
Solid Tee & Plaid Print Cami Dress,8.25
3pcs Solid Tee Bodysuit,21.4
Contrast Lace Pleated Hem Dress,17.0
EMERY ROSE Knot Front Pocket Patched Overall Romper Without Tube Top,11.0
Colorblock Belted A-line Dress,12.0
SHEIN EZwear Zip Up Thumb Holes Jacket,12.0
EMERY ROSE Color Block Dual Pocket Drop Shoulder Duster Cardigan,18.0
High Waisted Straight Leg Jeans,18.4
SHEIN VCAY Notched Neck Block Stripe Belted Tank Romper,13.0
SHEIN EZwear Zipper Front Vest Puffer Coat,15.4
Argyle Knit V-neck Sweater Vest Without Tee,9.0
High Waist Patch Detail Raw Cut Flare Leg Jeans,25.0
EMERY ROSE Color Block Ribbed Knit Sweater,13.0
Colorblock Cut Out One Shoulder One Piece Swimsuit,12.4
SHEIN EZwear Solid Elastic Waist Sweatpants,10.4
Swiss Dot Lantern Sleeve Mock Neck Bodycon Dress,16.0
SHEIN VCAY Striped Pattern Cut Out Slit Hem Sweater Dress,20.4
SHEIN EZwear 2pcs Solid Drawstring Waist Sweatpants,16.7
Floral Pattern Fringe Trim Halter Push Up Crochet Tankini Top,5.0
Solid Bikini Bottom,4.49
All Over Print Shirred Ruffle Hem Dress,16.0
SHEIN Unity Plaid Print Scoop Neck Belted Dress,11.5
SHEIN Unity Solid Slant Pocket Skinny Pants,10.0
SHEIN SXY High Waist Split Thigh Skirt,7.49
Guipure Lace Panel Pointelle Knit Drop Shoulder Sweater,14.9
Geo Pattern Knit Top,8.0
Ditsy Floral Print Ruffle Hem Dress,15.0
Bikinx Floral Print Whip Stitch Bikini Top,10.0
SHEIN EZwear Crop Cami Top & Sweatpants,18.4
SHEIN EZwear Solid Zip Up Straight Leg Pants,18.0
Plain Contrast Mesh High Waisted Bikini Swimsuit,7.48
SHEIN ICON Twist Front Asymmetrical Hem Crop Tube Top & Bodycon Skirt,12.0
SHEIN ICON Solid Super Crop Sweater,8.0
Swiss Dot Bishop Sleeve Blouse,8.49
Twist Front Rib Knit Top,7.49
EMERY ROSE Glen Plaid Drawstring Ankle Cut Pants,12.4
Floral Print Tie Neck Flounce Sleeve Frill Trim Blouse,11.4
Double Breasted Lapel Collar Overcoat,28.4
Solid Shawl Collar Blazer,23.4
Solid Eyelet Embroidery Tee,8.49
Contrast Binding Tie Side Bikini Bottom,5.49
U-ring Tube Tie Side Thong Bikini Swimsuit,10.0
SHEIN Unity Backless Batwing Sleeve Solid Tee,6.0
SHEIN EZwear Overlap Waist Flare Leg Pants,10.4
Floral Print Shirred Waist Cut Out Tie Backless Layered Hem Halter Dress,16.4
EMERY ROSE Embroidery Mesh Insert Bishop Sleeve Fitted Dress,18.4
Ruched Crisscross Underwire Bikini Top,6.49
Drop Shoulder Tie Dye Pullover & Sweatpants Set,12.4
SHEIN ICON Flap Pocket Denim Skirt,17.0
Solid Dual Pockets Ribbed Knit Cardigan,22.0
Lapel Collar Single Button PU Leather Blazer,20.0
Rib-knit Sweetheart Neck Crop Knit Top,11.0
Hollow Out Cover Up Dress Without Bikini,8.49
Open Front Kimono,11.0
Notched Neck Pleated Hem Dress,19.0
Letter & Car Graphic Drop Shoulder Pullover,9.0
Contrast Lace Flounce Sleeve Scallop Trim Tunic Dress,8.5
SHEIN SXY Shawl Neck Open Front Blazer & Pants Suit,36.4
Plaid Flap Pocket Drop Shoulder Coat,28.0
Tropical Print Bikini Swimsuit,8.98
Floral & Paisley Print Tie Back Dress,8.0
Contrast Binding Triangle Thong Bikini Swimsuit,9.0
SHEIN EZwear Drawstring Waist Patched Detail Shorts,10.0
Allover Floral Knot Split Thigh A-line Dress,17.0
Lapel Collar Belted PU Trench Coat,32.0
4pcs Rib Knit Solid Tank Top,14.4
SHEIN Unity Shirred Waist Lettuce Trim Shorts,7.0
Polka Dot Print Butterfly Sleeve Shirred Ruffle Trim Wrap Hem Dress,19.0
Drop Shoulder Textured Crop Sweater & Knit Shorts Set,22.0
SHEIN Solid Contrast Mesh Sleeve Split Hem Fitted Dress,15.4
Ditsy Floral Print Petal Sleeve Blouse,8.0
SHEIN PETITE Solid Unitard Tank Romper,6.49
SHEIN SXY High Waist Flap Pocket Side Shorts,11.0
SHEIN Frenchy Ribbed Knit Lantern Sleeve Tee,5.25
SHEIN ICON Solid Backless Crop Halter Top,5.0
Striped Shorts Bikini Swimsuit,13.0
SHEIN SXY Sweetheart Neck Wrap Cross Crop Knit Top,8.49
Lapel Collar Double Breasted Flap Detail Blazer,17.0
Letter Graphic Track Shorts,6.49
Petal Sleeve Ruffle Trim Wrap Hem Belted Dress,21.0
SHEIN SXY Solid Unitard Tank Romper,7.49
Plain Cover Up Pants Without Bikini Panty,7.49
SHEIN EZwear Scoop Neck Rib-knit Crop Tee,4.49
Striped Tape High Waisted Bikini Swimsuit,12.0
Ruffle Hem Open Front Cardigan,17.4
SHEIN PETITE Hanky Hem Lace Up Back Crop Tube Top,5.0
High Waist Bleach Wash Ripped Skinny Jeans,16.4
SHEIN EZwear Zip Up Puffer Vest Coat,19.0
evoluSHEIN Tie Neck Pocket Detail Sleeveless Jumpsuit,20.0
SHEIN BASICS Cotton Solid Bodycon Mini Skirt,6.0
Letter Graphic Drop Shoulder Thermal Pullover,9.49
Scoop Neck Drop Shoulder Crochet Cover Up Without Bikini,13.0
Plaid Drawstring Bandeau Bikini Swimsuit,10.4
Zip Back Chiffon A-line Dress,26.4
SHEIN VCAY Cut Out Split Thigh Tube Dress,11.0
EMERY ROSE Button Detail Asymmetrical Hem Tee,7.49
Striped Bikini Swimsuit,12.0
SHEIN Unity Contrast Lace Ruched Halter Top,3.8
SHEIN Unity Solid Batwing Sleeve Key Hole Back Blouse,7.49
Stripe Button Front V Neck Tee,7.49
Colorblock Pattern Drop Shoulder Sweater,20.0
EMERY ROSE Crisscross Backless Wide Leg Cami Jumpsuit,14.0
SHEIN SXY Solid Scoop Neck Unitard Romper,8.0
Solid Bikini Panty,5.49
SHEIN Tall Notched Neck Batwing Sleeve Popover Blouse,8.0
Scoop Neck Drop Shoulder Crochet Cover Up Without Bikini,21.4
Swiss Dot Tie Backless Puff Sleeve Ruffle Hem Dress,33.0
EMERY ROSE Chevron Pattern Drop Shoulder Duster Cardigan,16.4
SHEIN BAE Asymmetrical Neck Sequin Dress,12.0
All Over Print Wrap Neck Tie Back Dress,20.0
Letter & Heart Print Round Neck Tee,25.0
Solid Zip Up Drop Shoulder Thermal Lined Crop Hoodie,11.4
SHEIN VCAY Twist Front Open Back Crop Top,19.0
Color Block Drop Shoulder Sweater,14.0
EMERY ROSE Glen Plaid Drawstring Ankle Cut Pants,13.0
High Waist Ripped Skinny Jeans,25.4
Contrast Binding Rib Micro Triangle Bikini Swimsuit,18.0
Hollow Out Cover Up Dress Without Bikini,11.0
Solid High Waist Flap Pocket Cargo Pants,15.0
Ditsy Floral Print Petal Sleeve Blouse,12.0
SHEIN VCAY Chevron Print Backless Halter Top,12.4
Simplee Lace Trim Lace Mesh Dress,7.0
SHEIN High Low Hem Pleated Swing Dress,8.0
Striped Drop Shoulder Sweater,10.5
Heart Print Tie Neck Lantern Sleeve Dress,5.75
Ditsy Floral Ring Linked Bikini Swimsuit,11.0
Ditsy Floral Button A-line Dress,18.0
SHEIN MOD Tie Backless Ruched Halter Top,11.0
EMERY ROSE Swiss Dot Side Solid Dress,16.4
Graphic Print Tie Back Plunging Neck Batwing Sleeve Dress,11.4
SHEIN Belle Surplice Neck Lantern Sleeve Wrap Dress,6.8
Halter Triangle Bikini Top,13.9
Allover Floral Knot Split Thigh A-line Dress,14.0
SHEIN EZwear Drawstring Hem Vest Puffer Coat,4.0
Asymmetrical Neck Slim Fit Bodysuit,19.0
EMERY ROSE Exaggerate Ruffle Trim Jacquard Combo Dress,6.0
Cut-out Bandeau Bikini Swimsuit,10.0
EMERY ROSE Notched Neckline Lantern Sleeve Dress,8.0
SHEIN High Waisted Graphic Ripped Jeans,15.4
Plain Asymmetrical Cut-out Bikini Swimsuit,5.0
EMERY ROSE Laser Cut Scalloped Dress,19.4
Random Floral Print Halter Smocked Tie Side Bikini Swimsuit,18.0
Floral Print Tie Neck Flounce Sleeve Frill Trim Blouse,18.0
SHEIN Frenchy Ditsy Floral Tie Neck Ruffle Hem Dress Without Belt,7.0
Swiss Dot Bishop Sleeve Blouse,7.49
Hollow Out Tie Back Cover Up,11.0
Lapel Collar Double Breasted Flap Detail Blazer,7.75
Ditsy Floral Underwire Bikini Top,17.9
Floral Print Tie Neck Flounce Sleeve Dress Without Belt,14.4
Striped Ruched One Piece Swimsuit,12.6
Bikinx Floral Print Whip Stitch Bikini Swimsuit,10.4
Colorblock Cut Out Tie Back Underwire One Piece Swimsuit,15.0
Allover Floral Print Lantern Sleeve Belted Dress,11.0
SHEIN Flap Pocket Cargo Jeans,11.0
Colorblock Whip Stitch Triangle Bikini Top,19.0
Polka Dot Print Butterfly Sleeve Shirred Ruffle Trim Wrap Hem Dress,15.0
Solid Button Up Shirt,14.0
SHEIN VCAY Ditsy Floral Lantern Sleeve Cut Out Tie Back Crop Blouse,12.0
EMERY ROSE Heart & Polka Dot Dress,18.4
SHEIN EZwear Drop Shoulder Button Up Shirt,10.4
Fake Button Tank Top,20.0
Drop Shoulder Open Front Crop Cardigan,13.0
Floral Print Lantern Sleeve Belted Dress,12.4
Solid Drop Shoulder Shirt,21.9
Letter Graphic Thermal Lined Sweatshirt,7.49
SHEIN PETITE Shirred Waist Layered Hem Skirt,24.4
Floral Bandeau High Cut Bikini Swimsuit,7.0
Notched Neck Leaf Print Belted Dress,23.0
EMERY ROSE Drop Shoulder Zip Up Hooded Cardigan,13.4
SHEIN Unity Single Button Lapel Collar Blazer,13.0
Lantern Sleeve Sweater Dress,17.4
Zebra Striped Print Cut Out Cami Dress,14.4
Criss Cross Contrast Binding Cami Top,18.0
SHEIN EZwear Scoop Neck Flounce Sleeve Crop Tee,31.0
SHEIN SXY Color Block Lettuce Trim Pointelle Knit Tube Sweater Dress,8.0
Asymmetrical Neck Ruched Wrap Hem Sequin Prom Dress,5.25
SHEIN PETITE Solid Scoop Neck Unitard Jumpsuit,12.4
SHEIN Frenchy Ruffle Armhole Ditsy Floral Dress,12.0
SHEIN BAE Solid Long Sleeve Cheeky Bodysuit,22.4
Colorblock Belted A-line Dress,11.4
SHEIN Tall Notched Neck Batwing Sleeve Popover Blouse,8.88
SHEIN SXY Crisscross Tie Backless Crop Halter Top & Bodycon Skirt,9.0
Random Plant Print Bikini Swimsuit,6.0
Solid Open Front Blazer,10.0
Ripped Raw Cut Straight Leg Jeans,4.0
Notched Neck Flounce Sleeve Tunic Dress,5.75
Guipure Lace Insert Ruffle Hem Dress,15.0
Striped Print Asymmetrical Hem Cami Jumpsuit,20.0
Random Print Smocked Halter Bikini Swimsuit,10.4
Shawl Collar Pleated Hem Belted Dress,11.4
Two Tone Overlap Hem Sweater,12.0
Floral Print Tie Neck Butterfly Sleeve Blouse,19.4
Random Allover Floral Print Ruffle Trim Tie Back Dress,10.0
Tie Side Bikini Bottom,27.0
High Waist Ripped Straight Leg Jeans,8.49
evoluSHEIN Tie Neck Pocket Detail Sleeveless Jumpsuit,8.49
SHEIN SXY Cow Print High Waisted Flare Leg Pants,14.4
EMERY ROSE Solid Backless Tube Dress,11.4
Floral Print Frill Trim Flounce Sleeve Blouse,12.3
SHEIN MOD Ruched Bust Hanky Hem Wide Straps Top,7.5
Drop Shoulder Crop Solid Cardigan,11.0
SHEIN VCAY Tie Front Split Hem Dress,7.0
SHEIN Frenchy Swiss Dot Contrast Guipure Lace Blouse,4.98
Stripe Button Front V Neck Tee,18.4
3pack Random Tropical Print Halter Drawstring Side Bikini Swimsuit,9.49
SHEIN ICON Split Thigh PU Leather Skirt,8.0
Heart Pattern Drop Shoulder Sweater,13.4
Contrast Lace Mesh Overlay Dress,8.0
SHEIN SXY Solid Crop Ribbed Knit Top,13.4
SHEIN Frenchy Two Tone Puff Sleeve 2 In 1 Blouse,9.25
EMERY ROSE Marble Print Button Front Blouse,17.4
SHEIN EZwear Notch Neck Lettuce Edge Rib-knit Tank Top,12.4
Allover Print Shirred Cuff Bishop Sleeve Blouse,9.0
Solid Rib Bikini Panty,9.35
Guipure Lace Insert Flounce Sleeve Ruffle Hem Dress,19.0
Solid Ruched Side Pencil Hem Tank Dress,8.0
SHEIN SXY Fringe Trim Plunging Neck Split Back Velvet Bodycon Dress,8.49
SHEIN Unity Wide Waistband Solid Leggings,9.49
Allover Print Ruffle Trim Shirred Waist Dress,6.0
SHEIN SXY Solid High Waist Unitard Jumpsuit,13.4
Twist Asymmetrical Hem Dolman Sleeve Tee,4.49
One Shoulder Layered Ruffle Trim Tunic Dress,21.0
SHEIN ICON Stripe Pattern Drop Shoulder Super Crop Sweater Without Cami,8.49
SHEIN SXY Solid Wideband Waist Biker Shorts,5.49
Flounce Sleeve Fold Pleated Belted Dress,9.0
SHEIN Frenchy Ribbed Knit Lantern Sleeve Tee,9.0
SHEIN BAE Strappy Open-Back Cheeky Bodysuit,23.4
Colorblock Raglan Sleeve Sweater,6.0
Ring Linked Halter Bikini Swimsuit,10.2
SHEIN Unity Solid High Waist Leggings,9.0
Allover Plant Print Notch Neck Ruffle Hem Dress,5.0
SHEIN BIZwear Solid Button Front Waistcoat,8.0
SHEIN EZwear V Waist Flare Leg Pants,11.0
Heart Print Half Zip Tee,6.49
SHEIN SXY Cut Out Waist Tube Bodycon Dress,9.25
SHEIN Frenchy Wrap Cross Drop Shoulder Tee,6.49
SHEIN Unity Square Neck Ruched Mesh Top,6.0
Pom-pom Trim Bikini Shorts,8.49
Heart Print Tie Backless Ruffle Hem Dress,14.0
Ring Linked Triangle Thong Bikini Swimsuit,23.0
SHEIN Unity Solid Waffle Knit Crop Tee,11.0
Solid Batwing Sleeve Blouse,6.0
SHEIN Unity Round Neck Batwing Sleeve Sweater,6.49
SHEIN ICON Tie Backless Ruched Halter Jumpsuit,20.0
Solid Ruched Stacked Skinny Jeans,8.49
Allover Print Tie Side Bikini Swimsuit,13.4
Half Button Drop Shoulder Tee,11.0
SHEIN EZwear Solid Drawstring Waist Wide Leg Sweatpants,13.0
High Waist Bleach Wash Ripped Skinny Jeans,5.49
Contrast Binding Halter Triangle Bikini Top,8.49
Contrast Binding High Cut Bikini Swimsuit,18.0
4pack Solid Crop Tank Top,14.8
SHEIN BASICS Solid Form Fitted Tee,7.0
SHEIN Belle Knot Shoulder Backless Mermaid Hem Formal Dress,18.0
SHEIN SXY Split Hem Tube Dress,11.0
Smocked Tie Side Bikini Swimsuit,20.0
Colorblock Pointelle Knit Drawstring Hooded Cardigan,12.4
SHEIN MOD Solid Cami Crop Top,25.0
Plaid Shawl Collar Open Front Blazer,12.0
EMERY ROSE Embroidery Mesh Insert V Neck Blouse,10.4
SHEIN EZwear Rib-Knit Crop Cami Top,8.49
Mock Neck Drop Shoulder Sweater,24.4
Smocked Ring Linked Bandeau Bikini Swimsuit,15.4
SHEIN SXY Solid Backless Crop Tank Top,4.49
Colorblock Contrast Collar Blouse,5.75
Notched Neck Pleated Hem Dress,8.0
SHEIN SXY Tie Backless Drawstring Side Crop Halter Top,19.4
Slogan Graphic Thermal Lined Sweatshirt,9.49
SHEIN Bell Sleeve Knot Front Crochet Kimono,7.0
One Shoulder Layered Ruffle Trim Tunic Dress,11.0
SHEIN EZwear Solid Crop Tank Top,9.0
Asymmetrical Neck Ruched Wrap Hem Sequin Prom Dress,7.0
Solid Kangaroo Pocket Thermal Lined Hoodie,10.0
SHEIN EZwear 3pcs Solid Backless Cami Romper,17.0
Overlap Collar Shirred Waist Dress,8.0
Twist Asymmetrical Hem Dolman Sleeve Tee,10.0
SHEIN EZwear Square Neck Slim Fit Bodysuit,3.85
Letter Graphic Thermal Lined Sweatshirt & Sweatpants,12.4
SHEIN BIZwear Plaid Wide Leg Pants,22.0
SHEIN Unity Plaid Print Scoop Neck Belted Dress,21.0
SHEIN SXY Solid Maxi Bodycon Dress,13.4
SHEIN BAE Solid High Rise Tailored Pants,22.0
Solid Crisscross Tie Back Cami Top,3.0
SHEIN EZwear Star Pattern Distressed Drop Shoulder Sweater,8.49
Floral Embroidery Pleated Hem Lace Cami Dress,15.0
Smocked Micro Triangle Tie Side Bikini Swimsuit,14.0
Split Thigh Cover Up Skirt,19.0
Palm Random Print Adjustable Strap Bikini Swimsuit,9.0
Floral Print Off Shoulder Lantern Sleeve Knot Front Blouse,23.4
Sheer Asymmetrical Hem Cami Top,5.49
Allover Print Batwing Sleeve Blouse,12.0
Ring Linked Bandeau Bikini Swimsuit,8.49
Solid High Neck Rib Knit Sweater,7.0
Contrast Lace Mesh Overlay Dress,18.0
EMERY ROSE Embroidery Mesh Insert Bishop Sleeve Fitted Dress,9.0
Heart Pattern Drop Shoulder Sweater,5.49
Tropical Print One Piece Swimsuit With Cover Up Skirt,6.0
Ripped Raw Trim Denim Shorts,8.34
SHEIN ICON Twist Front Cut Out Ruched Bodycon Dress,6.0
Zip Back Chiffon A-line Dress,8.49
Polka Dot Print Butterfly Sleeve Shirred Ruffle Trim Wrap Hem Dress,16.0
Solid High Neck Tank Top,14.4
Herringbone Peplum Hem Coat,5.0
EMERY ROSE Laser Cut Scalloped Dress,12.4
Solid Elastic Waist Slant Pocket Sweatpants,12.0
SHEIN BIZwear Ruched Lantern Sleeve Bodysuit,19.0
Drop Shoulder Two Tone Crop Bomber Jacket,12.4
EMERY ROSE Solid Button Up Cardigan,30.4
Leopard Petal Sleeve Top,11.0
Tie Back Ruffle Sleeve Peplum Blouse,9.34
Floral Print Flounce Sleeve Blouse,22.4
Plain Backless Cover Up,16.0
SHEIN ICON Flap Pocket Side Cargo Pants,13.0
Half Zipper Placket Drop Shoulder Sweatshirt,13.4
SHEIN SXY Elastic Waist Solid Bodycon Skirt,23.4
Ripped Frayed Hem Mom Jeans,15.4
Pearls Heart Detail V-neck Drop Shoulder Sweater,13.4
Ripped Raw Cut Denim Shorts,11.0
High Waist Straight Leg Pants,14.4
Cut And Sew Babydoll Dress,11.2
SHEIN Frenchy Turtleneck Raglan Sleeve Split Hem Sweater,9.99
Color Block Longline Cardigan,13.4
Slant Pocket High Waist Boyfriend Jeans,14.0
Plain V Neck Bikini Swimsuit,10.0
SHEIN Unity Zip Up Sleeveless Puffer Coat,18.4
V Wired Split Hem Sequin Cami Dress,12.0
ROMWE Slogan Cartoon Face Graphic Oversized Tee,26.0
Wideband Waist Solid Biker Shorts,19.4
Drop Shoulder Curved Hem Tee,5.7
SHEIN EZwear Cartoon Print Drop Shoulder Sweatshirt,12.4
Solid Cross Back One Piece Swimsuit,18.0
SHEIN BAE Solid Ruched Split Thigh Satin Cami Dress,14.4
Ribbed Knit Scoop Neck Crop Tee,14.0
Vertical Stripe Pattern Drop Shoulder Sweater,6.0
ROMWE STPL Solid Contrast Lace Ruched Tee,8.49
SHEIN Unity Quarter Zip Drop Shoulder Sweater,20.4
Floral Print Shirred Flounce Sleeve Ruffle Hem Dress,10.4
SHEIN Frenchy Striped Trim Drop Shoulder Cricket Sweater,12.0
Plain Halter Micro Triangle Bikini Swimsuit,19.7
Tie Front Ruched Jumpsuit,10.0
SHEIN SXY Solid Criss-cross Backless Bodycon Dress,14.4
Floral Smocked Underwire Bikini Top,15.0
ROMWE Kawaii Contrast Lace Cold Shoulder Sweater,6.49
Floral Print Smocked Triangle Thong Bikini Swimsuit,16.0
SHEIN ICON 90s Low Rise Ruched Flare Leg Pants,5.49
V Neck Cable Knit Sweater Vest,5.49
Solid Drop Shoulder Tee,8.0
Contrast Lace Plunging Cover Up,12.4
SHEIN Modely Houndstooth Shoulder Pads Mock Neck Bodycon Dress,9.06
Slant Pocket Bootcut Leg Jeans,3.75
Solid V Bra Bodysuit,21.0
Tie Dye Drop Shoulder Oversized Tee,25.4
2pack Cover Up,18.0
Floral Print Knot Back Underwire Bikini Swimsuit,9.0
Floral Print Belted Dress,7.49
Paper Bag Waist Wide Leg Pants,9.0
Heart Pattern Sweater,8.0
SHEIN Unity Single Button Lapel Collar Blazer,22.0
SHEIN BAE Solid Fitted Tee,13.0
SHEIN BASICS Scoop Neck Solid Crop Top,12.0
Criss Cross Front Halter Top,8.49
Eyelet Embroidery Contrast Lace Puff Sleeve Blouse,13.0
Mock Neck Keyhole Back Blouse,13.0
Swiss Dot Tie Backless Puff Sleeve Ruffle Hem Dress,7.0
Plaid Print Drop Shoulder Shirt,7.49
SHEIN ICON Tie Front Peplum Crop Cami Top,12.0
High Neck Drop Shoulder Split Hem Wrap Longline Sweater Without Belt,6.0
Cable Knit Sweater Vest,5.49
Letter Graphic Thermal Lined Sweatshirt,15.0
Textured High Cut Bikini Swimsuit,7.49
Straight Leg Leather Look Jeans,10.4
Dalmatian Print Butterfly Sleeve Blouse,22.0
Surplice Neck Fringe Hem Sequins Dress,8.49
Slant Pocket Skinny Jeans,7.0
Color Block Chunky Knit Sweater,10.9
Solid Drop Shoulder Round Neck Sweater,12.4
SHEIN Unity Solid Bishop Sleeve Blouse,5.5
Ditsy Floral Print Butterfly Sleeve Shirred Ruffle Hem Dress,11.0
Square Neck Shirred Bodice Flounce Sleeve Ruffle Hem Dress,10.0
Solid Drawstring Slant Pocket Sweatpants,10.0
SHEIN Unity Rib-knit Solid Crop Cami Top,11.0
SHEIN Unity Scoop Neck Bishop Sleeve Tee,21.4
SHEIN Unity Form Fitted Bodysuit,46.4
Heart & Stripe Pattern Drop Shoulder Sweater,7.0
SHEIN Unity Solid Form Fitted Bodysuit,16.4
SHEIN SXY Puff Sleeve Double Button Blazer & Pants,15.0
Cherry Embroidery Lantern Sleeve Cardigan,8.49
Random Allover Floral Print Ruched Bust Ruffle Hem Cami Dress,18.0
Allover Print Ruffle Trim Shirred Waist Dress,7.0
SHEIN BAE Cowl Neck Asymmetrical Hem Cami Dress,14.0
Leather Look Zipper Fly Flare Leg Jeans,16.0
V Wired Bikini Swimsuit,2.82
SHEIN Unity Tie Back Sleeveless Tank Dress,15.4
O-ring Detail Textured Bikini Swimsuit,6.0
Draped Collar Chain Detail Crisscross Backless Ruched Cami Dress,8.35
Solid Ribbed Crop Tank Top,19.0
Tropical Print Backless Knot Halter Neck Slit Thigh Dress,17.0
Allover Print Roll Up Sleeve Dress,13.4
SHEIN SXY Scoop Neck Unitard Jumpsuit,8.0
Floral Print Ruched Split Thigh Satin Cami Dress,14.6
SHEIN Solid Contrast Mesh Sleeve Split Hem Fitted Dress,19.4
Plain Halter Micro Triangle Bikini Swimsuit,22.4
SHEIN SXY Lace Trim Hook & Eye Cami Top,21.0
Heart Pattern Drop Shoulder Sweater,15.4
Zipper Fly Flap Pocket Cargo Jeans,11.0
Ditsy Floral Flounce Sleeve Blouse,12.0
EMERY ROSE Dandelion Print Ombre Tee,12.0
Triangle Tie Side Bikini Swimsuit,8.49
Plain Knot Kimono,17.4
Ruched Side Wrap Tank Top,16.4
Keyhole Back Halter Bodycon Dress,22.0
High Neck Raglan Sleeve Sweater,14.0
