Cloth_Desc,Price
SHEIN MOD Twist Front Wide Strap Top,35.4
SHEIN Unity 3pcs Turtle Neck Ribbed Knit Sweater,6.0
Drop Shoulder Tie Dye Pullover & Shorts Set,39.0
SHEIN VCAY Solid Bustier Rib-knit Bodysuit,12.0
EMERY ROSE Floral Raglan Sleeve Pullover,10.0
Chevron Tape Bikini Swimsuit,7.64
Solid Flounce Sleeve Smock Dress,12.0
SHEIN SXY Shawl Neck Open Front Blazer & Pants Suit,14.0
EMERY ROSE Roll Sleeve Button Front Shirt,36.4
Crisscross Tie Backless Cut Out Ruffle Hem Split Thigh Dress,9.0
Mock Neck Frill Trim Ruffle Blouse,19.0
Solid Drawstring Zip Up Crop Thermal Hoodie,7.0
EMERY ROSE Grid Print Notched Neckline Blouse,13.0
SHEIN Unity Tie Back High Neck A Line Dress,6.0
SHEIN EZwear Solid Flare Hem Cami Dress,20.0
SHEIN SXY Shirred Knot Side Asymmetrical Hem Cover Up Skirt,8.0
SHEIN EZwear Ribbed Knit Raglan Sleeve Shrug Crop Cardigan Without Cami Top,14.4
SHEIN Unity Solid Tank Top & Split Thigh Skirt,16.0
Floral Print Pleated Cap Sleeve Top,9.49
Tie One Shoulder Shirred Guipure Lace Panel Dress,10.0
SHEIN EZwear Zipper Fly Fold Pleated Solid Wide Leg Pants,19.4
Colorblock Raglan Sleeve Pointelle Knit Crop Sweater,16.0
EMERY ROSE Square Neck Puff Sleeve Dress,19.0
Criss Cross Plunging One Piece Swimsuit,15.4
Guipure Lace Panel Blouse,12.0
SHEIN Frenchy Allover Floral Print Tie Front Shirred Back Slit Thigh Cami Dress,7.49
Ditsy Floral Tie Neck Dolman Sleeve Blouse,16.4
Cartoon Graphic Drop Shoulder Oversized Tee,11.0
SHEIN VCAY One Shoulder Knot Side Floral Dress,9.0
Tree And Letter Graphic Sweatshirt,35.0
SHEIN BASICS Drop Shoulder Solid Crop Pullover,13.0
Colorblock Lace Up Back Crop Knit Top,9.0
Striped Pattern Oversized Sweater,17.4
Hollow-out Knitted Cover Up,19.4
SHEIN SXY One Shoulder Drawstring Knot Side Split Thigh Dress,13.4
SHEIN MOD Solid Deep V Neck Knotted Shoulder Ruched Dress,17.0
Solid Raw Hem Denim Shorts,15.4
Allover Floral Print Puff Sleeve Surplice Neck Dress,19.4
DAZY Solid Ribbed Knit Sweater,12.4
SHEIN BAE Scoop Neck Mesh Panel Crop Tee,5.49
Cut Out Twist Front Tie Back Crop Cami Top,6.0
Solid Eyelet Embroidery Tee,8.0
Shirred Bodice Ruffle Hem Dress,19.4
Allover Print High Cut Bikini Swimsuit,9.0
SHEIN BAE Mock-Neck Tied Backless Crop Top,7.49
Colorblock Raglan Sleeve Sweater,17.0
High Waist Straight Leg Jeans,21.0
Tie Front Knotted Backless Ruffle Hem Dress,13.4
Allover Print Round Neck Blouse,8.0
SHEIN SXY Ruched Off Shoulder Mesh Bodycon Dress,20.0
SHEIN SXY Solid Zipper Front Unitard Jumpsuit,17.0
Plunging Neck Cut Out Front Bodycon Dress,8.25
Solid Tie Side Bikini Swimsuit,8.0
SHEIN SXY Mock Neck Marble Print Bodycon Dress,8.0
Textured Halter Push Up Bikini Swimsuit,11.4
SHEIN SXY Split Front Tie Backless Halter Top & Flare Leg Pants,17.0
SHEIN SXY Deep V Neck Ripped Crop Sweater,14.4
SHEIN Unity Square Neck Fitted Top,9.0
SHEIN BIZwear High Neck Form Fitted Top,8.0
Sheer Embroidered Mesh Tie Front Kimono,14.4
High Waist Plicated Detail Wide Leg Pants,16.4
EMERY ROSE Striped Single Button Front Flounce Hem Dress,15.0
DAZY Two Tone Drop Shoulder Sweater,23.0
Ditsy Floral Crisscross Tie Backless Cami Dress,11.0
SHEIN EZwear Striped Trim Cable Knit Sleeveless Sweater Dress Without Blouse,9.5
Twist Front High Cut Bikini Swimsuit,12.0
Letter Embroidery Thermal Lined Pullover,12.0
Flap Pocket Denim Shorts,19.0
SHEIN BAE Solid PU Leather Bodysuit,11.0
DAZY Solid High Neck Tee,8.49
SHEIN PETITE Ruched Side Glitter Cami Bodycon Dress,8.0
Solid V Neck Tee,13.0
SHEIN EZwear Scoop Neck Tank Top and Track Shorts,14.4
Allover Print Boat Neck Tee,9.0
Ruffle Trim Swiss Dot Shirred Back Dress,17.0
Allover Print Knot Side Wrap Dress,19.0
SHEIN SXY Solid Cut Out Bodycon Dress,15.0
SHEIN EZwear Scoop Neck Bell Sleeve Crop Tee,7.49
Solid Drop Shoulder Sweater,19.0
Tie Back Batwing Sleeve Solid Blouse,11.0
Solid Pocket Zipper Fly Winter Coat,28.0
Mock Neck Batwing Sleeve Sweater,18.0
All Over Print A-line Dress,13.4
SHEIN BAE Solid Crop Tank Top,6.0
Color Block Ribbed Knit Tank Top,5.49
SHEIN BAE Square Neck Asymmetrical Hem PU Tank Top,5.49
Dalmatian Cut-out One Piece Swimsuit,13.4
Plain Halter Triangle Bikini Swimsuit,11.0
ROMWE STPL Solid Ruched Tee,10.0
Striped Pattern Drop Shoulder Sweater,19.0
Slogan Graphic Drop Shoulder Tee,9.0
SHEIN BASICS Ribbed Knit Crop Tee,6.49
Plunging Neck Flutter Sleeve Slit Hem Bodycon Dress,17.4
SHEIN EZwear Twist Front Tie Front Crisscross Top,9.0
SHEIN MOD Plant Print Lettuce Trim Tank Top,5.0
EMERY ROSE Mock Neck Ribbed Knit Top & Leopard Slit Skirt Without Belt,9.06
Plain Halter Triangle Bikini Swimsuit With Cover Up,16.4
Plaid Flap Pocket Drop Shoulder Shirt Without Belt,8.75
Floral Print Straight Leg Jeans,23.4
EMERY ROSE Notch Neck Smock Dress,18.4
DAZY Ribbed Knit Drop Shoulder Sweater,19.0
Curvy High Stretch Raw Hem Skinny Jeans,21.4
SHEIN SXY Single Button Glitter Blazer & Slant Pockets Shorts,27.0
Polka Dot Puff Sleeve Ruffle Hem Dress,18.4
Bikinx Chain Cutout Front Bodycon Dress,11.4
High Cut Bikini Panty,5.0
Heart Print Round Neck Tee,6.0
SHEIN ICON Lettuce Trim Bandana Hem Tie Backless Crop Halter Top,4.0
Colorblock Top Stitching Oversized Tee,9.49
Criss Cross Tie Back Halter Top,5.49
SHEIN ICON Twist Front Textured Crop Tube Top,4.0
Joyfunear One Shoulder Wrap Split Thigh Sequin Formal Dress,31.0
Joyfunear Twist Shoulder Belted Split Thigh Dress,25.0
SHEIN SXY Ribbed Knit V Back Bodycon Dress,6.25
Allover Print Ruffle Trim Shirred Waist Dress,15.4
Frill Trim Tie Back Cover Up,8.49
Solid Eyelet Embroidery Tee,8.0
SHEIN EZwear Drop Shoulder Tee & Pants,20.0
SHEIN EZwear Scoop Neck Tank Top and Track Shorts,13.4
Swiss Dot Bishop Sleeve Blouse,12.0
Butterfly Print Crew Neck Tee,5.0
Zip Up Drop Shoulder Drawstring Thermal Lined Hoodie,11.1
Lapel Collar Pleated Hem Shirt Dress,25.0
Square Neck Flounce Sleeve Tie Back Crop Milkmaid Blouse,15.0
Ribbed Knit Slim Fit Bodysuit,9.49
Contrast Panel Zip Up Hoodie & Sweatpants,23.0
SHEIN VCAY Knot Front Butterfly Sleeve Top & Split Thigh Skirt,18.0
SHEIN EZwear Scoop Neck Solid Crop Tee,3.25
Solid Drawstring Crop Thermal Lined Hoodie,10.0
SHEIN Floral & Chain Print Tee & Skirt,18.0
SHEIN SXY Shawl Neck Open Front Blazer & Pants Suit,36.4
ROMWE Star Print Raglan Sleeve Tee,6.0
Sollinarry Allover Print Blouse & Paperbag Waist Shorts Set,20.6
SHEIN SXY Solid Notch Neck Crop Top & Dollar Print Skirt,20.0
Leopard Print Deep V Neck Lantern Sleeve Bodycon Dress,16.4
SHEIN BAE Fringe Trim One Shoulder Bodysuit,9.49
Motorcycle & Letter Graphic Tee,5.49
Letter Graphic Thermal Lined Sweatshirt,11.4
SHEIN BIZwear Solid High Neck Slim Tee,8.0
Palm Tree & Slogan Graphic Notched Neck Tank Top,5.0
SHEIN BAE One Shoulder Twist Crop Top & Split Thigh Skirt Set,18.4
Mesh Insert Mock Neck Bodycon Dress,9.0
SHEIN SXY Off Shoulder Satin Bodycon Dress,19.4
Plain Smocked Frill Trim Bikini Swimsuit,13.4
High Waist Wide Leg Jeans,26.0
SHEIN EZwear Solid Split Thigh Dress,10.4
Sparkly Glitter Halter Triangle Bikini Swimsuit,8.0
Drawstring Waist Knot Front Jeans,18.0
Ring Linked Triangle Tie Side Bikini Swimsuit,10.4
Stitch Detail Swim Dress With Shorts,15.4
Turtleneck Flounce Sleeve Pleated Hem Belted Dress,24.0
SHEIN SXY Cut Out M-slit Hem Mesh Maxi Cami Dress,17.0
Solid Drop Shoulder Crop Tee,17.0
SHEIN SXY Solid High Cut Zipper Bodysuit,8.0
Waffle Knit Crop Tank Top & Split Thigh Skirt,9.0
SHEIN SXY Colorful Striped Print Tube Top & Skirt,13.4
Floral Print Keyhole Back Dress,7.49
2pack Chiffon Knot Cover Up,11.4
Expression & Letter Graphic Drop Shoulder Drawstring Thermal Hoodie,7.0
Floral Random Print Triangle Bikini Swimsuit,15.4
SHEIN VCAY Ring Linked Criss-cross Tie Backless M-slit Hem Maxi Dress,8.0
Rib Halter Triangle Bikini Swimsuit,23.0
Drawstring Side Color Block Bodycon Tank Dress,8.0
1pc Fuzzy Trim Bustier Crop Tube Top,13.0
Fake Button Tank Top,13.4
DAZY Solid Drop Shoulder Oversized Tee,7.49
Pocket Patched Button Up Shirt With Shorts,17.0
Mock Neck Drop Shoulder Sweater,21.0
Paisley Print Single Breasted Drop Shoulder Shirt,17.0
SHEIN SXY Body Heat Map Print Bodycon Dress,14.4
Ruched Slim Fit Bodysuit,8.49
High Waist Cargo Jeans,9.0
Button Front Belted Tank Romper,20.4
High Waist Raw Hem Denim Shorts,15.0
Letter Patched Varsity Jacket,14.0
Plain Textured Underwire Bikini Swimsuit,16.0
Mountain & Moon Print Tie Dye Tee,10.0
Leopard Mock Neck Flounce Sleeve Blouse,8.49
SHEIN Unity Round Neck Batwing Sleeve Sweater,8.49
SHEIN EZwear Star Print Crop Tank Top,16.4
Striped Plunging Neck Fold Pleated Detail Dress,6.49
Plunging Underwired Top With High Cut Bikini,14.0
EMERY ROSE Mesh Insert Square Neck Flare Hem Dress,9.49
PARTHEA Floral Print Hanky Hem Zip Back Corset Tank Top,13.4
Rib Tie Side Bikini Swimsuit,15.0
High-Rise Slant Pocket Tapered Pants,8.49
Colorful Striped Tie Back Cami Dress,13.0
Letter & Palm Tree Print Thermal Pullover,18.0
Solid Square Neck Sweater,10.4
Random Tie Dye Halter Triangle Bikini Swimsuit,6.75
SHEIN SXY Halterneck Tied Backless Cut-out Bodycon Dress,8.0
Allover Floral Print Backless Knot Halter Neck Slit Thigh Dress,5.0
Heart Pattern Drop Shoulder Sweater,15.0
High-Rise Solid Jeans,15.0
Floral Print Butterfly Sleeve Ruffle Hem Belted Dress,24.0
SHEIN Frenchy Dalmatian Print Frill Trim Chiffon Smock Dress,19.4
DAZY 1pc Quarter Zip Drop Shoulder Sweater,16.0
Quarter Zip Drop Shoulder Sweater & Knit Pants,27.4
SHEIN PETITE Rib-knit Scoop Neck Bodysuit,45.4
Lace-up Front Backless Textured Crop Halter Top,6.49
High Waist Straight Leg Jeans,7.0
SHEIN ICON Floral Print Cami Top,24.0
1pc Solid Bustier Crop Cami Top,6.49
SHEIN SXY Solid Maxi Bodycon Dress,12.0
PU Leather O-ring Crop Halter Top,14.4
Floral Print Tie Back Butterfly Sleeve Dress,7.49
Ruffle Trim Shirred Back Dress,12.4
Random Floral Print High Waist Bikini Swimsuit,13.4
SHEIN EZwear Mock Neck Crop Tee & Flare Leg Pants,12.0
SHEIN PETITE Shirred Waist Layered Hem Skirt,13.4
SHEIN SXY Split Thigh Ruched Cami Dress,12.0
Cut Out Ripped Raw Hem Skinny Jeans,7.75
Floral Print Belted Ruffle Trim Dress,21.49
Random Tropical Print Triangle Tie Side Thong Bikini Swimsuit,18.0
Floral Print Contrast Binding Bandeau Bikini Swimsuit,10.4
One Shoulder Cut Out Top & Split Thigh Skirt,7.49
Ruched Bodycon Satin Cami Dress,15.0
Plain Tie Side High Cut One Piece Swimsuit,12.7
SHEIN EZwear Kangaroo Pocket Drop Shoulder Drawstring Hoodie,12.0
Rib Ring Linked High Cut Bikini Swimsuit,20.4
Zip Side Solid Tailored Pants,11.0
EMERY ROSE Slub Knit Curved Hem Tee,14.4
SHEIN Unity Drawstring Sleeve Button Front Shirt Dress,8.49
Letter Graphic Drop Shoulder Thermal Lined Sweatshirt,18.0
Button Half Placket Dolman Sleeve Tee,10.4
SHEIN EZwear Letter Patched Crop Varsity Jacket,11.4
SHEIN Frenchy Half Zip Drop Shoulder Split Hem Sweater,15.0
Solid Dual Pockets Ribbed Knit Cardigan,23.4
Solid Textured Bikini Top,22.0
DAZY Solid Snap Button Front Tee,6.0
Puff Sleeve Zip Back Jumpsuit,8.49
Colorblock Contrast Lace Panel Smock Dress,17.4
Tied Cutout Front Ruffle Trim Wrap Hem Dress,16.0
Colorblock Contrast Collar Blouse,14.4
SHEIN High Waist Roll Hem Denim Shorts,13.0
Keyhole Back Frill Trim Eyelet Embroidery Dress,14.0
SHEIN VCAY Criss Cross Backless Ruffle Hem Cami Dress,15.4
SHEIN MOD Sweetheart Neck Layered Hem Dress,24.0
SHEIN Unity Scoop Neck Crop Fitted Top,19.0
SHEIN Frenchy Ditsy Floral Print Butterfly Sleeve Dress,8.0
Slant Pocket High Waist Boyfriend Jeans,13.0
Two Tone Criss Cross Halter Top & Bodycon Skirt,20.4
Color Block Chevron Pattern Drop Shoulder Sweater,10.4
SHEIN VCAY Ribbed Knit Tube Top & Biker Shorts,19.0
SHEIN Unity Plunging Double-Breasted Mini Blazer Dress,11.0
SHEIN EZwear Marled Knit Solid Tee,29.0
Solid Round Neck Tee,6.0
Solid Tie Backless Cami Dress,6.49
Letter And Heart Print Tee,19.0
Lapel Neck Single Breasted Teddy Coat,6.49
Cutout Solid Crop Top,27.4
SHEIN EZwear Scoop Neck Rib-knit Crop Tee,6.0
Solid Button Front Blouse,6.49
Plain Cut Out Cover Up,17.0
SHEIN EZwear Solid Elastic Waist Shorts,18.0
Jacquard Guipure Lace Fringe Hem Tie Back Crop Tube Top,6.49
Ditsy Floral Tie Front Button Through Dress,10.0
SHEIN VCAY Cut Out Front Tropical Print Dress,18.4
SHEIN EZwear Solid Rib-knit Backless Dress,7.49
SHEIN BASICS Cotton Heather Grey Cropped Leggings,7.0
Plain Hollow Out Drawstring Knitted Cover Up,8.49
Allover Print Lace Up Backless Cami Top,13.4
SHEIN SXY Solid Maxi Bodycon Dress,13.4
Rib Tie Back Halter Triangle Bikini Swimsuit,14.4
Solid Mock Neck Rib Knit Bodysuit,6.98
Heart Pattern Drop Shoulder Sweater,7.0
SHEIN ICON Solid Ribbed Knit Tube Top,20.0
SHEIN PETITE Solid Ruched Waist Flare Leg Pants,5.49
SHEIN SXY Halterneck Tied Backless Cut-out Bodycon Dress,11.0
Textured V Neck Bikini Swimsuit,5.0
SHEIN SXY Solid Zipper Back Unitard Jumpsuit,8.0
Tropical Print Twist Front Cut-out Split Thigh Cami Dress,18.4
Mesh Overlay Tie Shoulder Cami Dress,11.0
Drop Shoulder Crochet Cover Up,15.4
Solid Cheeky Bikini Panty,14.0
EMERY ROSE Keyhole Back Floral Print Dress,13.4
EMERY ROSE Surplice Neck Ruffle Trim Bodycon Dress,4.0
SHEIN Unity Crisscross Tie Backless Plunging Neck Romper,11.0
High Waist Ripped Straight Jeans,7.49
SHEIN VCAY Tropical Print Paperbag Waist Belted Combo Tank Romper,15.0
Drop Shoulder Pocket Patched Hooded Duster Cardigan,27.0
SHEIN MOD Floral Print Puff Sleeve Dress,13.0
SHEIN ICON Twist Front Textured Crop Tube Top,35.0
3pack Floral Print Halter Bikini Swimsuit & Beach Skirt,20.0
90s Floral & Letter Graphic Crop Tank Top,4.0
Notch Neck Rib-knit Tank Top,15.0
Cut Out Ripped Frayed Straight Leg Jeans,6.0
SHEIN BIZwear Ruched Lantern Sleeve Bodysuit,4.49
SHEIN EZwear Drop Shoulder Button Up Shirt,21.5
EMERY ROSE Batwing Sleeve Allover Heart Print Dress,13.0
Heart Print Tee,18.0
SHEIN MOD Ruched Bust Hanky Hem Cami Top,7.49
Ribbed Ring Linked Bikini Swimsuit,8.0
Off Shoulder Split Thigh Ruched Dress,8.0
Ditsy Floral Ruched Bust Knot Front Split Thigh Cami Dress,10.4
SHEIN SXY Metal Detail Crop Top,28.0
PARTHEA Zip Back Mesh Tube Top,11.4
Twist Front Plunging Neck Crop Top & Skirt,5.49
High Waist Patched Detail Wide Leg Pants,16.0
SHEIN ICON Split Hem Tie Backless Mesh Halter Top,18.0
SHEIN MOD Patchwork Print Cami Dress,23.4
Zip Fly Wide Leg Jeans,4.0
Color Block High Waisted Bikini Swimsuit,9.49
Rib-knit Crop Tank Top,26.4
SHEIN BAE Draped Bandana Hem Tie Backless Crop Sequin Halter Top,7.98
Floral Print Ruffle Trim Tie Side Wrap Dress,5.0
SHEIN BAE Solid Fitted Halter Top,5.0
SHEIN EZwear Ditsy Floral Print Lace Trim Cami Top,18.0
Pocket Front Drop Shoulder Sweater,5.49
Tropical Print Bikini Swimsuit,6.0
Backless Lace Up Crop Cami Top,18.0
Floral Print Ruched One Piece Swimsuit,13.0
ROMWE Fairycore Solid Frill Trim Tie Front Dress,4.49
Solid Smocked Push Up High Cut Bikini Swimsuit,13.0
Floral Smocked Tie Side Halter Triangle Bikini Swimsuit,13.0
Mock Neck Cut-out Rib-knit Slim Crop Tee,13.0
SHEIN EZwear Solid Zipper Fly Wide Leg Pants,11.4
Solid Bikini Panty,7.0
Plain Textured Halter Push Up High Cut Bikini Swimsuit,20.4
Drop Shoulder Coconut Tree Print Longline Tee,5.0
PARTHEA Solid Ruched Bodycon Dress,11.4
DAZY Zip Up Drop Shoulder Drawstring Thermal Lined Hoodie,11.4
3pack Solid Frill Trim Bikini Swimsuit & Beach Skirt,34.4
EMERY ROSE Block Striped Fitted Dress,30.0
3pack Plant Print Push Up Bikini Swimsuit & Kimono,14.0
Floral Print Knot Front Bikini Swimsuit & Kimono,9.0
Fuzzy Trim Textured Knit Cardigan,13.6
Slogan Graphic Drop Shoulder Tee,19.0
SHEIN Unity Form-Fitting Mock Neck Crop Top,19.0
Solid Turtleneck Knit Top,9.0
PARTHEA Ruched Wrap Bodycon Mesh Tube Dress,5.0
Drop Shoulder Dual Pocket Shirt & Shorts,14.0
Colorblock Surplice Neck Dress,29.4
Hollow Out Bandana Hem Tie Backless Halter Tankini Top,20.0
Brush Print Batwing Sleeve Blouse,18.4
Button Front Kimono,5.0
SHEIN SXY Solid Hidden Pocket Cami Dress,11.0
Solid Tie Backless Cami Dress,8.49
Paisley Print Blouse & Wide Leg Pants,11.0
Roll Cuff Batwing Sleeve Tee,19.0
Contrast Binding Ring Detail Halter Triangle Tie Side Bikini Swimsuit,24.4
SHEIN EZwear Drop Shoulder Ribbed Knit Tee & Biker Shorts,9.49
SHEIN SXY Ripped Raw Cut Denim Shorts,10.4
Ruffle Hem Allover Floral A-line Dress,15.4
SHEIN VCAY Tropical Print Tie Back Belted Dress,16.4
SHEIN SXY Button Front Flap Pocket Denim Jumpsuit,17.0
One Shoulder Dolman Sleeve Blouse,12.0
Ditsy Floral Print Tie Front Bikini Swimsuit,36.0
Hidden Pocket Ruffle Hem Smock Dress,12.4
Hollow Out Split Side Cover Up,10.4
EMERY ROSE Butterfly Sleeve Layered Hem Floral Dress,16.0
Embroidery Bootcut Leg Jeans,10.0
Solid Tank Top,23.0
SHEIN VCAY Allover Plants Print Drawstring Front Ruffle Cuff Dress,26.0
SHEIN SXY Twist Front Asymmetrical Hem Textured Knit Cami Top,6.0
Solid Bandeau Tie Side Bikini Swimsuit,15.0
Zip Up Drop Shoulder Drawstring Thermal Lined Hoodie,5.0
Batwing Sleeve Split Hem Tee,10.4
Rib Underwire High Cut Bikini Swimsuit,14.0
SHEIN EZwear Solid Cami Top & Plaid Sweatpants,11.4
Mock Neck Drop Shoulder Sweater,11.4
SHEIN EZwear High Waist Slant Pocket Cord Pants,8.75
SHEIN EZwear Solid Form Fitted Tee,18.0
Random Floral Print Knot Side Bikini Swimsuit,23.4
Solid Round Neck Tee,8.0
EMERY ROSE Knot Front Pocket Patched Overall Romper Without Tube Top,13.0
SHEIN Unity Square Neck Mermaid Hem Bodycon Dress,7.0
SHEIN Unity Solid Cami Top & Split Hem Grid Skirt Set,11.0
Slant Pocket Bootcut Leg Jeans,16.0
SHEIN Belle Surplice Neck Lantern Sleeve Wrap Dress,4.63
Drop Shoulder Textured Crop Sweater & Shorts Set,25.0
Allover Print Batwing Sleeve Blouse,17.0
SHEIN Unity Mock Neck Solid Bodycon Dress,22.0
SHEIN SXY Hollow Out Mock Neck Crop Tank Top & Leggings,16.0
SHEIN Modely Raglan Lantern Sleeve Flounce Hem Swiss Dot Dress,10.0
Solid Ribbed Knit Drop Shoulder Sweater,13.0
SHEIN ICON 90s Dopamine Dressing Tie Back Halter Top & Flared Leg Pants,26.0
Solid Crisscross Tied Backless Crop Tee,17.4
High-rise Raw Hem Flare Jeans,17.0
Slogan Graphic Drop Shoulder Tee,6.0
Cut-out Back Bikini Swimsuit,17.4
SHEIN Unity High Waist Wide Leg Pants,9.49
Bikinx Color Block Open Knit Cover Up Without Bikini,10.0
Roll Cuff Ruffle Hem Solid Dress,21.0
Open Knit Bell Sleeve Sheer Sweater Without Bra,18.0
SHEIN Unity Shawl Collar Open Front Blazer and Slant Pocket Pants Set,13.0
Paisley & Ditsy Floral Tie Side Bikini Swimsuit,14.4
SHEIN MOD Cut Out Tie Back Ruffle Trim Wrap Hem Slip Dress,25.0
SHEIN VCAY Solid Cami Dress,11.0
EMERY ROSE Ribbed Fitted Turtleneck Sweater,15.0
SHEIN EZwear Scoop Neck Crop Tee,8.0
EMERY ROSE Ribbed Fitted Turtleneck Sweater,10.0
SHEIN EZwear Scoop Neck Crop Tee,9.49
SHEIN SXY Half Zip Crop Tank Top & Mini Pleated Skirt,13.4
SHEIN ICON Seam Detail Backless Bandana Crop Top,6.0
Solid Drop Shoulder Tee,9.0
Halter Triangle Tie Side Bikini Swimsuit,16.0
SHEIN ICON Lace Up PU Leather Tube Top & Bodycon Skirt,17.0
SHEIN BAE Solid Ribbed Knit High Cut Tank Bodysuit,6.0
Geo Print Bodycon Dress,6.0
Plunging Neck Ruffle Hem Ditsy Floral Dress,8.49
SHEIN EZwear Solid Drawstring Pocket Detail Sweatshirt & Sweatpants Set,13.0
SHEIN SXY Cartoon Graphic Crop Tank Top & Biker Shorts,12.0
Twist Front Rib-knit Tube Top & Split Thigh Skirt Set,18.4
Random Floral Print Shirred Waist Knot Front Ruffle Hem Dress,21.0
Button Up Drop Shoulder Blouse With Shorts,31.0
SHEIN SXY Solid Criss-cross Backless Bodycon Dress,21.4
Drawstring Waist Hidden Pocket Asymmetrical Hem Tank Dress,7.49
Rib Halter Micro Triangle Bikini Swimsuit,12.0
Random Floral Print High Waist Bikini Swimsuit,15.0
Allover Floral Ruffle Hem Dress,22.0
High Waist Wide Leg Jeans,10.0
SHEIN SXY One Shoulder Crop Top & Bodycon Skirt,26.0
SHEIN ICON One Shoulder Cut Out Crop Top,15.0
Surplice Neck Frill Trim Ditsy Floral Dress,40.0
Allover Floral Print Flounce Sleeve Smock Dress,20.0
SHEIN MOD Solid Cami Crop Top,22.0
Solid Cut Out Ruched Bodycon Dress,21.4
Plain Textured Bikini Swimsuit,9.49
One Shoulder Cut Out Ruched Tie Backless Dress,23.0
SHEIN VCAY Tropical Print Split Thigh Belted Halter Dress,9.0
SHEIN SXY High Neck Rib-knit Tee,20.0
Half Zip Backless Halter Top,13.0
Seam Detail Flare Leg Jeans,20.0
Ditsy Floral Tie Front Shirred Mermaid Hem Cami Dress,8.49
SHEIN Unity Ribbed Knit Crop Tank Top,23.0
SHEIN Unity Ribbed Long Sleeve Semi-Cropped Tee,13.0
Ditsy Floral Button A-line Dress,6.49
Textured V Neck Bikini Swimsuit,15.4
SHEIN ICON Asymmetrical Neck Sheer Mesh Top Without Bra,18.0
SHEIN EZwear Kangaroo Pocket Drop Shoulder Drawstring Hoodie,19.0
High Waist Ripped Raw Trim Denim Shorts,19.0
Chain Detail Back Metallic Cami Top,13.4
SHEIN SXY High Waist PU Bodycon Skirt,12.0
DAZY Slogan Graphic Drop Shoulder Tee,50.0
SHEIN EZwear Butterfly Print Hoodie & Sweatpants,51.0
SHEIN Frenchy Collared Fold Pleated Waist Curved Hem Shirt Dress,11.0
SHEIN SXY Deep V Neck Puff Sleeve Dress,13.5
Guipure Lace Panel Ruffle Sleeve Blouse,15.4
Ripped Knit Knit Tube Top With Bolero,6.49
Allover Print Button Front Dress Without Belt,9.49
Plain Ring Linked Bikini Swimsuit,6.25
1pc Fuzzy Trim Bustier Crop Tube Top,7.0
SHEIN Unity Asymmetrical Neck Twist Hem Tee Dress,14.4
Ribbed Knit Drop Shoulder Sweater,14.0
SHEIN SXY Solid Maxi Bodycon Dress,21.0
Cut Out Ripped Frayed Straight Leg Jeans,8.49
Contrast Lace Cold Shoulder Dolman Sleeve Sweater,12.0
4pcs Solid Ribbed Knit Bodysuit,12.0
Textured Underwire Halter Bikini Swimsuit,17.0
Ring Linked Triangle Thong Bikini Swimsuit,7.49
Ruffle Hem Schiffy Cami Dress,4.0
Polka Dot Slant Pockets Tie Shoulder Jumpsuit Without Tube Top,12.0
Moustache Effect Flare Leg Jeans,10.4
Drop Shoulder Crop Solid Cardigan,6.0
SHEIN SXY Draped Collar Tulip Hem Crisscross Backless Satin Cami Dress,11.0
Tied Cutout Front Ruffle Trim Wrap Hem Dress,11.0
Embroidery Mesh Cover Up Without Bikini,13.0
Halter Triangle Tie Side Bikini Swimsuit,13.9
Marble Pattern Drop Shoulder Sweater,23.0
Solid Slant Pocket Backless Overall Romper Without Halter Top,15.4
3pack Halter Triangle Bikini Swimsuit & Cover Up,6.0
Ripped Roll Up Hem Denim Shorts,11.0
SHEIN SXY Asymmetrical Neck Cut Out Bodysuit,9.0
Butterfly Sleeve Ruffle Hem Allover Floral Dress,18.0
Bikinx Solid Knot Side Cover Up Dress,7.14
Criss-cross Tie Backless Split Thigh Ruffle Hem Cami Dress,14.0
Batwing Sleeve Knot Side Blouse,19.0
3pcs Tie Back Crop Top,7.0
EMERY ROSE Solid Zip Up Drawstring Hooded Sweatshirt,12.4
SHEIN EZwear Ribbed Cami Bodycon Mini Dress,13.0
SHEIN EZwear Ribbed Knit Chain Front Tie Back Crop Tee,14.0
SHEIN SXY Cut Out Front Crop Tube Top,11.4
Button Half Placket Dolman Sleeve Tee,8.0
SHEIN BASICS Solid Rib-knit Slim Tee,9.0
Zebra Stripe Bandeau Bikini Swimsuit,7.49
High Waist Ripped Raw Trim Denim Shorts,12.0
Chain Linked Micro Triangle Thong Bikini Swimsuit,14.0
Striped Print Batwing Sleeve Belted Shirt Dress,10.0
Ditsy Floral Off Shoulder Tie Front Ruffle Hem Dress,21.0
SHEIN VCAY Ribbed Knit Tube Top & Biker Shorts,9.49
EMERY ROSE Patchwork Bishop Sleeve Blouse,8.0
SHEIN EZwear Solid Batwing Sleeve Tee,12.0
Keyhole Back Halter Bodycon Dress,18.0
Solid Plunging One Piece Swimsuit,18.0
Tie Backless Bikini Swimsuit,20.0
Rhinestone Wings Pattern Drop Shoulder Tee,18.0
SHEIN EZwear Drawstring Waist Pocket Parachute Pants,15.4
Letter Graphic Thermal Sweatshirt,29.0
SHEIN ICON 90s Butterfly Print Rhinestone Tube Top,17.9
Houndstooth Lapel Collar Dual Pockets Blazer Without Belt,55.4
SHEIN Unity Solid Halter Neck Bodycon Dress,20.0
Plain Bikini Swimsuit,19.4
SHEIN BASICS Cotton Solid Form Fitted Bodysuit,17.0
SHEIN VCAY Tie Front Tube Top and Wide Leg Pants Set,4.0
Allover Print Shirred Knot Backless Cami Dress,4.0
Floral & Slogan Graphic Drawstring Thermal Lined Hoodie,14.4
Reflective Butterfly & Figure Graphic Drop Shoulder Tee,7.49
Open Front Ribbed Knit Cardigan,17.4
SHEIN SXY Off The Shoulder Glitter Bodycon Dress,15.4
Plain Textured Bikini Swimsuit,13.4
Leopard Petal Sleeve Top,25.0
Color Block Tank Top,23.0
SHEIN EZwear Lace Trim Ditsy Floral Dress,3.5
Cut Out Ring Linked Thong Bikini Swimsuit,12.0
Striped Drop Shoulder Zipper Front Sweater,7.49
SHEIN Tall Ripped Straight Leg Jeans,12.0
Solid Push Up Bikini Swimsuit,12.4
EMERY ROSE Solid Drop Shoulder Hoodie,21.0
Letter & Expression Print Drop Shoulder Tee,18.0
Ribbed High Waist Bikini Swimsuit,22.0
DAZY Half Zip Drop Shoulder Oversized Fleece Sweatshirt,13.0
Jacquard Guipure Lace Fringe Hem Tie Back Crop Tube Top,10.0
Color Block Ribbed Knit Tank Top,5.49
SHEIN PETITE Ruched Side Glitter Cami Bodycon Dress,8.49
SHEIN EZwear Solid Drawstring Waist Sweatpants,16.4
PARTHEA Ruched Wrap Asymmetrical Hem Satin Cami Dress,24.0
Ditsy Floral Print Shirred Ruffle Trim Dress,17.0
SHEIN SXY Solid Zip Front Puffer Coat,31.0
Plaid Flap Pocket Drop Shoulder Shirt Without Belt,15.0
3pack Floral Triangle High Cut Bikini Swimsuit,12.4
SHEIN ICON Flounce Sleeve Lettuce Trim Shirt,15.0
Patched Detail Flap Pocket Wide Leg Jeans,32.0
Floral Pattern Smocked Bikini Top,6.49
Contrast Lace Pleated Hem Dress,18.0
Solid Crop Tube Top,6.0
Tie Waist Crochet Cover Up Skirt,11.0
SHEIN MOD Solid Cami Crop Top,3.0
Ditsy Floral Print Shirred Waist Dress,15.0
Ripped Raw Hem Denim Jacket,19.0
Solid V Neck Button Detail Tee,13.0
SHEIN Unity Off Shoulder Rib-knit Fitted Dress,9.49
Tropical Print Knot Side Belted One Piece Swimsuit,10.4
3pack Halter Triangle Bikini Swimsuit With Wave Print Cover Up,13.0
SHEIN BAE Two Tone Twist Front Cut Out Split Thigh Dress,16.0
Neon Blue Contrast Trim One Shoulder High Waist Bikini Swimsuit,12.0
SHEIN Frenchy Ditsy Floral Backless Knot Ruffle Trim Dress,15.0
Solid Ring Linked Bikini Swimsuit,11.0
SHEIN PETITE Solid Shirred Frill Trim Flared Skirt,11.0
