Cloth_Desc,Price
SHEIN MOD Floral Print Lace Up Side Hanky Hem Tube Top,15.0
EMERY ROSE Buttoned Front Curved Hem Tee Dress,21.0
DAZY High Waist PU Leather Pants,23.0
SHEIN MOD Solid Crop Tube Top & Drawstring Waist Pants,13.0
SHEIN SXY Surplice Neck Metallic Top & Skirt,12.0
SHEIN VCAY Striped Cut Out Back Drawstring Waist Romper,6.0
ROMWE PUNK Grunge Floral Print Appliques Detail Ruched Cami Top,9.0
SHEIN Unity Frill Neck Layered Ruffle Armhole Sheer Mesh Detail Top,13.4
SHEIN Unity Flounce Sleeve Open Front Jacket,9.0
SHEIN PETITE Plaid Print Tummy Control Leggings,19.0
SHEIN SXY Cut Out Back Bodycon Dress,11.0
SHEIN Unity Allover Print Mock Neck Crop Top & Skirt,12.4
SHEIN Unity Tie Dye Criss Cross Waist Split Thigh Dress,14.4
DAZY Contrast Trim Knit Top,7.0
SHEIN ICON Solid Super Crop Halter Neck Top,8.0
SHEIN EZwear Camo Print Drawstring Crop Hoodie,34.0
DAZY Flap Detail Drop Shoulder Teddy Jacket,15.0
DAZY Solid Split Hem Pants,27.4
SHEIN BAE Notched Collar Satin Blazer & Cuffed Shorts,6.49
EMERY ROSE Floral Print Plicated Detail Blouse,14.0
SHEIN SXY Lantern Sleeve Plunging Neck Crop Blouse,13.0
SHEIN Split Hem Sequin Skirt,6.0
SHEIN SXY Ribbed Knit Button Front Crop Top,7.49
EMERY ROSE Twist Front Leopard Skirt,7.49
SHEIN VCAY Sweetheart Neck Puff Sleeve Twist Crop Top,5.0
SHEIN SXY Elastic Waist Flannel Shorts,16.4
SHEIN Mock Neck Split Hem Jumpsuit,6.49
DAZY Solid Raglan Sleeve Textured Tee,15.0
SHEIN Unity Drop Shoulder Marble Print Satin Shirt,6.0
SHEIN Tall Floral Print Mock Neck Mesh Top Without Bra,23.0
SHEIN SXY Leopard & Snakeskin Print Cut Out Tie Back M-slit Hem Maxi Dress,31.4
SHEIN BAE V Neck Vest Blazer & Pants,16.0
DAZY Ditsy Floral Paperbag Waist Skirt,20.0
SHEIN SXY High Waist PU Leather Flare Leg Pants,12.0
SHEIN SXY Surplice Neck Tie Back Glitter Crop Top,22.0
SHEIN Tall Striped Print Button Up Belted Shirt Dress,10.0
SHEIN ICON Grunge Surplice Neck Split Cuff Top,16.0
SHEIN Modely Paisley Print Button Front Shirt,9.49
EMERY ROSE Studded Detail Split Hem PU Leather Skirt,13.0
SHEIN MOD Floral Print Split Thigh Cami Dress,11.0
DAZY High Waist Solid A-line Skirt,24.0
SHEIN Modely Gigot Sleeve Fringe Trim Wrap Hem Dress,7.49
SHEIN EZwear Letter Graphic Notched Neckline Raglan Sleeve Crop Tee,18.0
EMERY ROSE Glen Plaid Single Button Peplum Blazer,30.0
DAZY Zip Up Drop Shoulder Teddy Jacket,6.49
DAZY Solid Round Neck Slim Tee,13.0
SHEIN BASICS Cotton Drawstring Pocket Track Shorts,14.0
SHEIN BAE Ruched Bust Split Thigh Dress,13.0
DAZY Quarter Button Rib Knit Tee,10.0
SHEIN EZwear Slogan Graphic Asymmetrical Neck Drop Shoulder Crop Pullover,18.4
SHEIN EZwear Skull Print Drop Shoulder Hoodie,31.0
SHEIN X Dr.kholoud Puff Sleeve Sequin Mesh Applique Belted Dress,13.0
SHEIN ICON Solid Super Crop Halter Neck Top,10.0
DAZY Contrast Trim Knit Top,18.4
DAZY Flap Detail Drop Shoulder Teddy Jacket,31.0
SHEIN EZwear Curved Hem Drawstring Crop Hoodie,9.0
SHEIN BAE Notched Collar Satin Blazer & Cuffed Shorts,5.0
SHEIN X Vincenttrinidadart Japanese Letter & Cartoon Graphic Drop Shoulder Oversize Tee,11.4
SHEIN ICON Western Cowgirl Colorblock Floral Print Contrast Lace Tie Front Top,8.0
SHEIN BAE Ruched Bust Split Thigh Dress,14.0
SHEIN SXY Lantern Sleeve Plunging Neck Crop Blouse,7.0
SHEIN ICON Star Print Drawstring Waist Flare Leg Pants,13.0
SHEIN SXY Ribbed Knit Button Front Crop Top,12.0
DAZY Solid Slant Pocket Suit Pants,15.0
SHEIN VCAY Sweetheart Neck Puff Sleeve Twist Crop Top,4.49
SHEIN Modely Paisley Print Button Front Shirt,11.0
SHEIN Mock Neck Split Hem Jumpsuit,5.49
SHEIN Modely Mock Neck Flounce Sleeve Colorblock Dress,20.4
SHEIN SXY Leopard & Snakeskin Print Cut Out Tie Back M-slit Hem Maxi Dress,22.0
SHEIN Unity Allover Print Mock Neck Crop Top & Skirt,6.49
SHEIN SXY Fringe Trim Tube Bodycon Dress,28.4
SHEIN EZwear Slogan Graphic Asymmetrical Neck Drop Shoulder Crop Pullover,6.49
DAZY Ditsy Floral Paperbag Waist Skirt,25.4
EMERY ROSE High Waist Contrast Lace Bodycon Skirt,17.0
SHEIN SXY Surplice Neck Tie Back Glitter Crop Top,15.0
SHEIN SXY Floral Print Lantern Sleeve Wrap Dress,15.0
SHEIN SXY Allover Butterfly Print Bodycon Dress,6.0
SHEIN PETITE Solid High Waist Stirrup Leggings,13.4
SHEIN ICON Grunge Surplice Neck Split Cuff Top,15.4
EMERY ROSE Vertical Striped & Polka Dot Batwing Sleeve Blouse,12.0
EMERY ROSE Studded Detail Split Hem PU Leather Skirt,14.0
SHEIN EZwear Embroidery Cartoon Ringer Tee,8.49
DAZY Zip Up Drop Shoulder Teddy Jacket,31.0
SHEIN SXY Split Thigh Bustier Dress,12.0
SHEIN BASICS Cotton Drawstring Pocket Track Shorts,11.0
EMERY ROSE Floral Embroidery A-line Dress,18.0
SHEIN EZwear Skull Print Drop Shoulder Hoodie,20.4
SHEIN EZwear Letter Patched Detail Crop Tee,13.0
SHEIN PETITE Solid Backless Unitard Romper,8.49
SHEIN MOD Square Neck Split Thigh Dress,11.0
SHEIN SXY Crop Halter Top & Knot Side Split Thigh Fringe Hem Skirt,15.0
SHEIN ICON Off Shoulder Trumpet Sleeve Crop Tee,6.0
SHEIN MOD Ruffle Trim Tie Front Flounce Sleeve Top,9.49
SHEIN BIZwear Allover Print Knot Side Wrap Blouse,6.0
SHEIN BAE Lace-up Back Crop Halter Top & Ruched Slit Skirt,7.0
SHEIN BAE Contrast Mesh Velvet Bodycon Dress,7.0
SHEIN Unity Ruched Off Sleeve Bodycon Dress,5.49
SHEIN EZwear Letter & Camo Print Drawstring Crop Hoodie,13.0
SHEIN VCAY Fruit Print Off Shoulder Puff Sleeve Backless Top,13.0
SHEIN MOD Floral Print Split Thigh Cami Dress,7.49
DAZY Plaid Print Drop Shoulder Shirt,7.0
SHEIN EZwear Letter & Expression Print Sweatpants,5.49
DAZY Lettuce Trim Tee Without Bra,18.0
SHEIN Split Hem Sequin Skirt,12.0
SHEIN SXY Swiss Dot Tie Front Ruffle Hem Cami Dress,19.0
SHEIN SXY Letter & Motorcycle Print Choker Neck Bodycon Dress,15.4
SHEIN Unity Wrap Knot Back Trumpet Sleeve Crop Blouse,13.0
EMERY ROSE 1pc Colorblock Puff Sleeve Ruffle Hem Dress,6.0
SHEIN SXY Mesh Panel Ruched Split Thigh Dress,14.0
SHEIN MOD Mushroom & Plant Print Flounce Sleeve Crop Blouse,19.0
SHEIN X Pretty Bratty Slogan Graphic Tee,18.0
SHEIN BAE One Shoulder Split Hem Velvet Bodycon Dress,17.0
SHEIN SXY Cut Out Drawstring Side Ruched Cami Mesh Bodycon Dress,20.0
SHEIN Modely Two Tone Frill Trim Lantern Sleeve Pleated Dress Without Belt,20.0
EMERY ROSE Allover Floral Print Drawstring Ruffle Hem Skirt,12.0
SHEIN EZwear Elastic Waist Wide Leg Sweatpants,7.0
SHEIN Unity Solid Crop Cami Top & Split Tie Back Skirt,15.0
SHEIN Belle One Shoulder Lantern Sleeve Sequin Bodycon Dress,12.0
SHEIN SXY Open Back Cutout Detail Ruched Bodycon Dress,17.0
SHEIN Modely Allover Floral Print Ruched Bodycon Dress,12.4
SHEIN MOD Grommet Lace Up Front Bandana Hem PU Leather Cami Top,7.0
SHEIN VCAY Allover Floral Print Sweetheart Neck Puff Sleeve Romper,22.0
SHEIN BAE Off The Shoulder Glitter Bodycon Dress,12.0
SHEIN Tall Allover Heart & Marble Print Flare Leg Pants,6.0
SHEIN PETITE Camo Print Round Neck Bodysuit,16.0
DAZY Drawstring Waist Wide Leg Pants,26.0
SHEIN Unity Cut Out Shoulder Mesh Insert Tank Top,12.0
EMERY ROSE Crisscross Back Striped Print Dress,9.49
SHEIN ICON Figure & Slogan Graphic Lettuce Trim Crop Top & Bodycon Skirt,11.0
SHEIN ICON Graphic Print Top-stitching Split Hem Crop Tee,9.49
SHEIN ICON Star Patched Crop Tee,17.4
SHEIN Unity Solid Ribbed Knit Cami Unitard Jumpsuit & Open Front Coat,9.0
SHEIN MOD Floral Print Lace Up Front Wide Strap Top Without Top,14.0
SHEIN SXY Elastic Waist Flannel Shorts,7.49
SHEIN SXY Zip Up Velvet Crop Jacket,9.0
SHEIN BAE Contrast Sequin PU Leather Skinny Pants,8.0
DAZY Striped Drop Shoulder Shirt,8.0
SHEIN PETITE 2pcs Solid Cami Top,11.0
SHEIN ICON 90s Raglan Sleeve Letter and Figure Graphic Crop Top,11.0
Dazy-Less Drop Shoulder Oversized Pullover Without Tee,8.49
EMERY ROSE Knot Cuff Ruffle Hem Smock Dress,15.0
SHEIN MOD Floral Print Lettuce Trim Cami Dress,10.4
SHEIN BAE Allover Print Lettuce Trim Mesh Bodycon Dress,24.4
SHEIN Unity Seam Front Pencil Skirt,5.0
SHEIN VCAY Floral Embroidery Open Front Vest Jacket,7.49
EMERY ROSE Allover Floral Print Butterfly Sleeve Dress,6.0
SHEIN SXY Ruched Asymmetrical Hem Rhinestone Detail Mesh Tube Top,9.0
SHEIN MOD Gigot Sleeve Button Front Shirt,9.0
DAZY Striped Button Front Shirt,19.4
SHEIN ICON Star Embroidery Fishnet Insert Drawstring Side Crop Tee,13.0
SHEIN X MELIKE FIRAT Off Shoulder Lantern Sleeve Asymmetrical Hem Crop Top,6.49
DAZY Frog Button Mandarin Collar Notched Hem Dress,9.49
SHEIN Modely Gigot Sleeve Fringe Trim Wrap Hem Dress,10.0
SHEIN Unity Allover Letter Graphic Sheer Mesh Crop Top Without Bra,32.4
SHEIN VCAY Lettuce Hem Leopard Mesh Skirt,25.4
SHEIN VCAY Tie Front Leopard Skirt,9.0
SHEIN ICON Western Cowgirl Striped Button Front V Neck Unitard Romper,14.4
SHEIN ICON Cut Out Mock Neck Tee,11.0
SHEIN BAE Sequin Cami Top & Flare Leg Pants,9.49
SHEIN BAE Single Button Velvet Blazer,18.0
EMERY ROSE Open Front Crop Jacket,9.0
Dazy-Less High Waist Slant Pockets Tailored Pants,12.0
SHEIN MOD Solid Ruched Asymmetrical Neck Tee,14.4
SHEIN Modely Zebra Striped Split Hem Mock Neck Bodycon Dress,11.4
SHEIN ICON Letter Graphic Stitching Detail Crop Tee,22.0
SHEIN BAE Leopard Jacquard Lantern Sleeve Cut Out Dress,5.0
SHEIN BAE Marble Print Crisscross Tie Backless Ruched Bodycon Dress,7.49
SHEIN EZwear Rhinestone Skeleton Print Shorts,20.0
SHEIN ICON Tie Front Lettuce Trim Sheer Top,20.0
SHEIN EZwear Square Neck Slim Fit Bodysuit,10.4
SHEIN Unity Chinese Dragon Print Sheer Mesh Flare Leg Pants,26.0
SHEIN EZwear Letter Graphic Leggings,15.4
ROMWE PUNK Grunge Zebra Striped Drawstring Front Flare Leg Pants,20.0
evoluSHEIN Letter Graphic Colorblock Drop Shoulder Half Zip Sweatshirt,9.0
SHEIN SXY Graphic Print Biker Shorts,18.4
DAZY Round Neck Velvet Tee,13.0
DAZY Top-stitching Drop Shoulder Pullover,12.0
SHEIN BAE Solid Ruched Tulip Hem Satin Shirt Dress,32.4
SHEIN SXY Tie Back Belted Bodycon Dress,12.0
SHEIN Unity Houndstooth Print Split Back Tweed Skirt,9.0
SHEIN SXY Argyle Print Contrast Mesh Crop Top & Bodycon Skirt,17.0
SHEIN MOD Tie Dye Lettuce Trim Cami Dress,7.49
SHEIN Tall Drop Shoulder Shirt & Wide Leg Pants,6.49
SHEIN BAE Zip Fly PU Leather Skinny Pants,11.0
SHEIN VCAY Ditsy Floral Drawstring Split Thigh Skirt,9.0
SHEIN SXY Off Shoulder Zip Back Asymmetrical Hem Dress,11.0
Frida Kahlo X SHEIN X Designer Sheer Mesh Insert Floral Print Top,17.0
DAZY Lettuce Trim Asymmetrical Hem Tee,12.0
SHEIN SXY Cowl Neck Split Thigh Satin Halter Dress,8.0
SHEIN Modely High Waist Fake Button Pencil Skirt,11.4
SHEIN MOD Chain Detail Asymmetrical Hem Cami Top,5.0
SHEIN SXY Off Shoulder Contrast Mesh Seam Front Bodycon Dress,5.0
SHEIN SXY Tie Backless Split Thigh Metallic Dress,5.49
SHEIN MOD Floral Print Lace Up Side Tube Top,10.4
DAZY Slogan & Figure Graphic Tee,13.4
SHEIN Frenchy Cowl Neck Polka Dot Cami Top,9.0
ROMWE PUNK Grunge One Shoulder Cut Out Asymmetrical Hem Top,20.0
EMERY ROSE Geo Print Batwing Sleeve Blouse,21.4
SHEIN SXY Figure Graphic Colorblock Scoop Neck Bodycon Dress,5.49
SHEIN BAE Buckle Belted PU Leather Bodycon Skirt,10.0
SHEIN MOD Solid Drawstring Side Crop Tee,10.0
SHEIN EZwear Zip Up Drawstring Hooded Velvet Bodycon Dress,18.4
SHEIN SXY Cowl Neck Crop Glitter Top & Drawstring Bodycon Skirt,9.49
SHEIN PETITE Marled Print Unitard Romper,30.0
SHEIN BIZwear Halter Neck Vest Blazer,25.4
SHEIN MOD Button Front Ruched Tee,16.0
EMERY ROSE Tank Top & Split Hem Pants,6.0
SHEIN PETITE Patched Front Flare Leg Pants,6.49
SHEIN EZwear Letter Graphic Drop Shoulder Bomber Jacket,9.49
DAZY Letter Graphic Drop Shoulder Drawstring Hoodie,8.0
SHEIN SXY Graphic Print Crop Top & Pencil Skirt,8.0
EMERY ROSE Double V-Neck Floral Print Cami Dress,10.0
SHEIN PETITE Zebra Striped Split Thigh Skirt,30.4
SHEIN PETITE Houndstooth Print Flounce Sleeve Ruffle Hem Bodycon Dress,5.0
SHEIN PETITE High Waist Lettuce Trim Pencil Skirt,21.4
SHEIN EZwear Rhinestone Metal Decor Scoop Neck Asymmetrical Hem Crop Tee,8.49
SHEIN SXY Tie Dye Crop Tube Top & Bodycon Skirt,10.0
SHEIN Unity Double Button Crop Blazer & Pleated Skirt,12.4
SHEIN EZwear Solid Rib Knit Cami Top,18.4
SHEIN EZwear Letter & Number Print Tee and Track Shorts,6.0
SHEIN EZwear Letter Graphic Split Thigh Tee Dress,14.0
SHEIN SXY Cut Out Waist Floral Allover Print Flare Leg Pants,9.49
SHEIN BAE Zip Back Bustier Lace Insert Satin Tube Top,6.0
SHEIN SXY Off Shoulder Split Thigh Rhinestone Velvet Dress,10.0
SHEIN MOD Tie Dye Asymmetrical Hem Cami Top,14.0
SHEIN EZwear Color Block Figure Graphic Tee Dress Without Belt,16.0
SHEIN EZwear Letter Graphic Cami Top & Biker Shorts Set,8.0
SHEIN EZwear Zip Up Crop Tank Top,11.0
SHEIN MOD Hanky Hem PU Leather Cami Top,7.49
SHEIN EZwear Letter Graphic Two Tone Zip Up Crop Jacket,16.0
DAZY Letter Pattern Drop Shoulder Crop Sweatshirt,19.0
SHEIN MOD Off Shoulder Twist Front Tee,16.0
DAZY Mountain & Slogan Graphic Drop Shoulder Tee,19.4
SHEIN Unity Solid Crop Cami Top & Checked Print Skirt,12.4
SHEIN SXY Drawstring Hem Raglan Sleeve Crop Hooded Jacket,19.0
SHEIN Polka Dot Print Tie Backless Halter Top & Ruffle Hem Skirt,27.0
SHEIN SXY Scoop Neck PU Leather Crop Top & Leggings,15.0
SHEIN Hollow Out Fringe Hem Drop Shoulder Kimono Without Bikini,5.49
SHEIN SXY Contrast Mesh Crop Fuzzy Top & Bodycon Skirt,9.0
SHEIN Unity Floral Knot Detail Shirred Cami Top & Ruffle Hem Skirt Set,7.49
SHEIN SXY Plaid Print Crop Tube Top & Skirt & Jacket,6.49
SHEIN X Ashley Baxter Figure Graphic Drop Shoulder Oversize Tee,7.0
SHEIN ICON Figure Graphic Asymmetrical Neck Lettuce Trim Crop Tee,7.0
SHEIN Unity Asymmetrical Neck Ruched Mesh Top,16.0
SHEIN SXY Draped Front Tie Backless Hanky Hem Crop Halter Top,36.4
SHEIN BAE Lettuce Edge Marble Mesh Top Without Bra,5.49
SHEIN ICON 2pcs One Shoulder Cut Out Crop Tee & Arm Sleeve,10.0
SHEIN ICON Anime Figure Graphic Crop Tee,5.0
SHEIN SXY Mock Neck Striped Print Unitard,13.0
SHEIN Unity Raglan Sleeve Double Breasted Belted PU Trench Coat,17.0
SHEIN EZwear Tie Dye Unitard Romper,6.0
SHEIN SXY Allover Print Asymmetrical Neck Split Thigh Bodycon Dress,14.9
SHEIN BAE Criss Cross Halter Neck Glitter Crop Top,5.44
SHEIN BAE Contrast Mesh Velvet Tube Top,32.0
SHEIN BAE Twist Front Ruched Pencil Skirt,18.0
Color Block Drop Shoulder Sweater,23.0
Floral Print Lantern Sleeve Belted Dress,9.49
Notched Neck Pleated Hem Dress,7.0
Colorblock One Shoulder Cut Out One Piece Swimsuit,7.49
Stitch Detail High Waisted Bikini Swimsuit,6.0
Colorblock Belted A-line Dress,8.49
Feather Print Notched Neck Bishop Sleeve Blouse,27.0
SHEIN EZwear Zip Up Puffer Vest Coat,6.49
EMERY ROSE Colorblock Boat Neck Sweater,11.0
Lapel Collar Double Breasted Flap Detail Blazer,15.4
SHEIN Frenchy Ribbed Knit Lantern Sleeve Tee,12.4
Solid Zip Up Drawstring Thermal Lined Hoodie,9.0
Letter Graphic Track Shorts,8.0
Swiss Dot Bishop Sleeve Blouse,25.0
Rib Binding Trim Halter Micro Triangle Bikini Swimsuit,8.49
SHEIN ICON Flap Pocket Denim Skirt,12.0
SHEIN Unity Solid Batwing Sleeve Key Hole Back Blouse,8.49
SHEIN EZwear Scoop Neck Rib-knit Crop Tee,17.0
Plain Open Front Kimono,10.4
Twist Front Rib Knit Top,22.0
Polka Dot Print Butterfly Sleeve Shirred Ruffle Trim Wrap Hem Dress,6.0
EMERY ROSE Knot Front Pocket Patched Overall Romper Without Tube Top,18.0
Knot Decor Bandeau Bikini Swimsuit,9.0
Letter Graphic Thermal Lined Sweatshirt,15.4
Allover Floral Knot Split Thigh A-line Dress,19.4
Tropical Leaf Print High Waisted Bikini Swimsuit,13.0
Drop Shoulder Tie Dye Pullover & Sweatpants Set,19.0
SHEIN ICON Twist Split Hem Tube Top,5.49
SHEIN EZwear Solid Elastic Waist Sweatpants,19.0
SHEIN VCAY Cut Out Split Thigh Tube Dress,9.0
Colorblock Triangle Bikini Top,7.0
SHEIN EZwear Solid Zip Up Straight Leg Pants,5.0
Tie Back Batwing Sleeve Solid Blouse,20.4
SHEIN ICON Solid Backless Crop Halter Top,4.0
SHEIN Belle One Shoulder Wide Leg Jumpsuit,12.0
EMERY ROSE Boat Neck Bishop Sleeve Belted Dress,8.49
SHEIN Unity Round Neck Batwing Sleeve Sweater,19.4
EMERY ROSE Boat Neck Bishop Sleeve Belted Dress,19.0
SHEIN Unity Round Neck Batwing Sleeve Sweater,15.4
Hollow Out Tie Back Cover Up,16.4
High Waisted Straight Leg Jeans,9.0
Guipure Lace Panel Pointelle Knit Drop Shoulder Sweater,35.0
SHEIN SXY Color Block Lettuce Trim Pointelle Knit Tube Sweater Dress,13.0
Lantern Sleeve Twist Front Wrap Hem Satin Dress,13.4
Plaid Drawstring Bandeau Bikini Swimsuit,15.4
Lace Bustier Crop Cami Top,14.5
Solid Shawl Collar Blazer,19.4
Heart Pattern Mock Neck Drop Shoulder Sweater,5.49
Plain Halter Triangle Bikini Top,8.0
SHEIN SXY Solid Mock Neck Unitard Jumpsuit,9.0
SHEIN Frenchy Striped Trim Drop Shoulder Cricket Sweater,7.49
SHEIN Tall Notched Neck Batwing Sleeve Popover Blouse,17.0
Mock Neck Lettuce Trim Ruffle Blouse,13.4
SHEIN EZwear Zipper Front Vest Puffer Coat,8.0
Solid One Knot Shoulder Asymmetrical Hem Dress,20.0
Petal Sleeve Ruffle Trim Wrap Hem Belted Dress,17.0
Hollow Out Cover Up Dress Without Bikini,8.25
Bikinx Floral Print Whip Stitch Bikini Swimsuit,8.0
Floral Smocked Triangle Tie Side Bikini Swimsuit,8.0
Plain Smocked Tie Side Bikini Swimsuit,17.0
Solid Kangaroo Pocket Thermal Lined Hoodie,14.4
Plain Smocked Ring Linked Bikini Swimsuit,9.0
SHEIN MOD Ruched Bust Hanky Hem Cami Top,9.0
SHEIN EZwear Solid Drawstring Waist Sweatpants,14.4
Solid Batwing Sleeve Blouse,16.4
SHEIN EZwear Overlap Waist Flare Leg Pants,15.0
Letter Graphic Thermal Lined Sweatshirt,23.0
Batwing Sleeve Sweater Dress,11.0
SHEIN ICON Flap Pocket Side Cargo Pants,9.5
SHEIN SXY Tie Backless Drawstring Side Crop Halter Top,19.0
Double Pocket Drop Shoulder Duster Cardigan,9.0
Twist Asymmetrical Hem Dolman Sleeve Tee,11.0
Solid Eyelet Embroidery Tee,8.49
Striped Plunging One-Piece Swimsuit,13.0
EMERY ROSE Drop Shoulder Zip Up Hooded Cardigan,9.0
Ditsy Floral Notched Neck Flounce Sleeve Blouse,17.0
SHEIN BASICS Solid Form Fitted Tee,19.0
Surplice Neck Self Tie Ruffle A-line Dress,15.0
Half Button Drop Shoulder Tee,22.0
Contrast Binding High Cut Bikini Swimsuit,19.0
Solid High Waist Flap Pocket Cargo Pants,28.0
SHEIN EZwear Crop Cami Top & Sweatpants,18.0
SHEIN MOD Solid Cami Crop Top,13.4
SHEIN Unity Solid Slant Pocket Skinny Pants,13.4
SHEIN Unity Single Button Lapel Collar Blazer,19.0
SHEIN BIZwear Ruched Lantern Sleeve Bodysuit,9.0
SHEIN EZwear Elastic Waist Flare Leg Pants,5.0
Solid Drop Shoulder Tee,9.06
3pack Random Tropical Print Halter Drawstring Side Bikini Swimsuit,16.4
Square Neck Shirred Bodice Flounce Sleeve Ruffle Hem Dress,8.75
4pack Solid Crop Tank Top,18.4
Plain Asymmetrical Cut-out Bikini Swimsuit,19.0
Floral Print Shirred Waist Cut Out Tie Backless Layered Hem Halter Dress,21.4
Lantern Sleeve Keyhole Back Blouse,27.0
SHEIN BAE Solid Ruched Split Thigh Satin Cami Dress,18.4
Color Block Longline Cardigan,5.0
Striped Drop Shoulder Sweater,6.0
SHEIN BAE Solid Fitted Tee,4.0
Knot Side Solid Batwing Sleeve Dress,9.49
Mock Neck Drop Shoulder Sweater,4.0
Fake Button Tank Top,6.25
Ring Linked Bandeau Bikini Swimsuit,8.49
SHEIN Tall Square Neck Lantern Sleeve Ruched Bodycon Dress,20.0
SHEIN Modely Houndstooth Shoulder Pads Mock Neck Bodycon Dress,5.0
SHEIN EZwear Solid Crop Tank Top,11.1
EMERY ROSE Swiss Dot Side Solid Dress,15.0
SHEIN ICON Solid Super Crop Sweater,23.0
Smocked Micro Triangle Tie Side Bikini Swimsuit,18.0
Random Allover Floral Print Ruched Bust Ruffle Hem Cami Dress,10.0
SHEIN BAE 1pc Square Neck Solid Bodysuit,18.0
Solid V Wired Bikini Swimsuit,6.0
SHEIN Frenchy Tie Neck Pocket Detail Sleeveless Jumpsuit,20.6
SHEIN BASICS Scoop Neck Solid Crop Top,20.0
SHEIN EZwear Rib-Knit Crop Cami Top,16.4
SHEIN Unity Solid Waffle Knit Ruched Side Crop Tee,9.49
Knot Waist Cover Up Skirt,5.49
Zip Back Chiffon A-line Dress,5.0
SHEIN BIZwear Solid Notch Neck Blazer,18.4
SHEIN ICON Tie Front Peplum Crop Cami Top,9.0
Tie Side Tank Dress,19.4
ROMWE STPL Hollow Out Crop Sweater,13.4
Zipper Fly Flap Pocket Boyfriend Jeans,26.0
SHEIN BAE Solid Long Sleeve Tee Bodysuit,10.4
SHEIN BAE Solid Tank Bodysuit,8.0
Triangle Tie Side Bikini Swimsuit,18.0
Leopard Petal Sleeve Top,10.4
ROMWE Slogan Cartoon Graphic Oversized Tee,15.4
Light Washed Cut Out Ripped Straight Leg Jeans,17.0
Floral Print Knot Back Underwire Bikini Swimsuit,7.49
Criss Cross Tie Back Crop Halter Top,11.4
Floral Print Butterfly Sleeve Ruffle Hem Belted Dress,17.0
Two Tone Twist Front Crop Tank Top,8.0
Solid Zip Up Drop Shoulder Thermal Lined Crop Hoodie,16.4
SHEIN ICON Ribbed Knit Crop Tank Top,17.0
Notch Neck Rib-knit Tank Top,14.4
SHEIN BAE Solid Straight Leg Pants,8.49
Plain One Shoulder Bikini Swimsuit,9.0
Allover Print Roll Up Sleeve Dress,15.0
SHEIN SXY Lace Trim Hook & Eye Cami Top,9.99
Slant Pocket Skinny Jeans,16.0
Tie Front Ruched Jumpsuit,10.0
Solid Ruched Side Pencil Hem Tank Dress,8.49
High Waist Ripped Raw Trim Denim Shorts,6.49
Eyelet Embroidery Contrast Lace Puff Sleeve Blouse,14.0
Solid Triangle Thong Bikini Swimsuit,13.4
SHEIN SXY Shawl Neck Open Front Blazer & Pants Suit,15.0
Solid Ribbed Crop Tank Top,13.0
Solid High Neck Rib Knit Sweater,18.0
SHEIN Belle Surplice Neck Lantern Sleeve Wrap Dress,10.4
Solid Mock Neck Puff Sleeve Blouse,12.0
Solid Elastic Waist Slant Pocket Sweatpants,8.0
SHEIN BAE Cowl Neck Asymmetrical Hem Cami Dress,15.0
EMERY ROSE Laser Cut Scalloped Dress,24.0
Color Block Ribbed Knit Tank Top,19.4
Plain V Neck Bikini Swimsuit,16.0
90s Floral & Letter Graphic Crop Tank Top,27.4
Two Tone Tie Back Triangle Thong Bikini Swimsuit,10.4
3pack Floral Micro Triangle Bikini Swimsuit & Beach Skirt,11.0
SHEIN SXY Plunging Neck Unitard Jumpsuit,7.0
Zip Half Placket Crop Slim Tee,14.4
SHEIN SXY Solid Ribbed Knit Unitard Jumpsuit,16.4
Geo Print Lantern Sleeve Blouse,18.0
SHEIN Belle Surplice Neck Lantern Sleeve Wrap Dress,9.49
Swiss Dot Frill Trim Cami Dress,7.49
SHEIN SXY Solid Round Neck Crop Tee,6.0
Asymmetrical Neck Satin Dress,8.49
Solid Drop Shoulder Tee,27.0
SHEIN SXY Scoop Neck Unitard Jumpsuit,15.4
Sleeveless Zip Up Crop Puffer Coat,9.0
High Waist Straight Leg Ripped Jeans,8.0
EMERY ROSE Floral Print Mock Neck Bodycon Dress,8.49
Button Up High Low Hem Shirt With Shorts,8.49
SHEIN Frenchy Two Tone Puff Sleeve 2 In 1 Blouse,10.4
Solid Drop Shoulder Shirt & Shorts Set,6.0
Solid Round Neck Thermal Pullover,9.0
SHEIN Unity Twist Backless Split Thigh Cami Dress,15.4
SHEIN BAE Solid Ruched Split Thigh Satin Cami Dress,19.4
SHEIN SXY Solid Mock Neck Unitard Jumpsuit,19.0
SHEIN BAE One Shoulder Cut Out Crop Top,5.49
Notched Neck Flounce Sleeve Tunic Dress,19.0
Tropical Print Keyhole Back Halter Dress,7.0
Solid Ruched Overlap Collar Sleeveless Blouse,20.4
Mock Neck Ribbed Knit Batwing Sleeve Sweater,4.0
Plaid Button Front Crop Jacket & Skirt,8.49
Twist Backless Raglan Sleeve Scoop Neck Waffle Knit Crop Top,15.4
PARTHEA Ruched Crop Cami Top & Twist Front Wrap Skirt,14.0
SHEIN SXY Button Front Lettuce Trim Shirt & Flare Leg Pants With Bra,11.0
SHEIN EZwear Zip Up Drawstring Puffer Vest Coat,8.0
SHEIN ICON 3D Body Print Crop Tee,8.49
SHEIN SXY Zip Up Drawstring Crop Puffer Coat,8.49
SHEIN ICON Solid Boat Neck Crop Top,9.34
Tie Shoulder Backless See Through Cover Up,9.0
Zipper Fly Flap Pocket Cargo Jeans,13.0
SHEIN BAE Tie Back Pleated Halter Dress,6.0
SHEIN PETITE Slant Pocket Elastic Waist Sweatpants,19.0
Colorblock V Neck Blouse,14.4
SHEIN MOD Crisscross Front Wide Strap Top,27.0
Twist Waist Wrap Hem Dress,17.4
SHEINBlues Stone Wash Middle-Waisted Straight Jeans,16.0
SHEIN VCAY Lace Up Open Back Cami Dress,27.4
SHEIN Unity Solid Backless Tank Dress,9.0
SHEIN PETITE High Waist Flap Pocket Cargo Jeans,11.0
Tied Cutout Front Ruffle Trim Wrap Hem Dress,9.49
Solid Ruched Bodycon Dress,27.0
Fishnet overlay Split Cover Up,14.4
Drop Shoulder Letter Graphic Tee,23.4
Bikinx Chain Cutout Front Bodycon Dress,8.49
Two Tone Twist Front Crop Tank Top,5.0
Kangaroo Pocket Drop Shoulder Sweatshirt,6.49
Cut Out Waist Split Hem Cami Bodycon Dress,11.4
SHEIN BAE Solid Backless Halter Dress,6.49
Thermal Lined Solid Sweatshirt With Sweatpants,16.0
Graphic Print Mermaid Hem Tube Dress,27.4
SHEIN SXY Halterneck Tied Backless Cut-out Bodycon Dress,25.4
SHEIN BAE 1pc Square Neck Solid Bodysuit,7.0
Crochet Backless Halter Neck Bodycon Dress,6.0
SHEIN Unity Solid Cami Unitard Jumpsuit,18.0
Tie Front Ruched Jumpsuit,12.0
Floral Print Tie Neck Smock Dress,19.0
SHEIN PETITE Rib-knit Scoop Neck Bodysuit,8.0
SHEIN EZwear Rib-knit Crop Tank Top,8.49
Rhinestone Skeleton Pattern Drawstring Thermal Hoodie,14.0
Surplice Neck Knot Wrap Dress,23.4
Flounce Sleeve Belted Sequins Dress,8.0
Allover Floral Print Puff Sleeve Surplice Neck Dress,27.4
SHEIN SXY Ring Linked Cut Out Drawstring Split Thigh Tube Dress,21.0
SHEIN ICON Tie Back Halter Top & Twist Front Skirt,7.0
Flounce Sleeve Mock Neck Belted Dress,16.4
DAZY Letter Patched Half Zip Drop Shoulder Teddy Sweatshirt,12.4
DAZY Scallop Trim Ribbed Knit Cardigan,12.4
SHEIN VCAY Ditsy Floral Cami Dress,16.0
SHEIN EZwear Letter & Car Print Drop Shoulder Tee,20.0
Solid Notched Neck Shirt,9.49
Solid Drop Shoulder Crop Tee,11.4
EMERY ROSE Shawl Collar Single Button Ruched Cuff Blazer,15.4
SHEIN Unity Crop Tube Top & Wide Leg Pants Set,17.0
SHEIN VCAY Allover Print Cami Dress,13.4
SHEIN BAE Lace Up Backless Split Thigh Cami Dress,16.0
SHEIN BASICS Scoop Neck Solid Crop Top,10.0
Tropical Print Button Front Cami Dress,18.0
evoluSHEIN Solid Form Fitted Tee,13.0
V Neck Batwing Sleeve Button Front Dress,12.4
SHEIN BAE Form Fitted Solid Tank Bodysuit,29.0
SHEIN EZwear Batwing Sleeve Textured Tee,26.0
Keyhole Back Solid Tunic Dress,15.0
SHEIN PETITE Crisscross Backless Ruched Cami Bodycon Dress,10.0
SHEIN VCAY Tied Shoulder Cami Dress,16.0
Knot Back Lantern Sleeve Ruffle Hem Dress,33.0
SHEIN SXY Zip Up Thumb Holes Jacket & Leggings,7.0
