Cloth_Desc,Price
Solid Push Up High Cut Bikini Swimsuit,7.0
Expression & Slogan Graphic Drop Shoulder Tee,25.0
SHEIN EZwear Letter Embroidery Drop Shoulder Sweatshirt,6.69
SHEIN SXY Flap Pocket Side Cargo Jeans,9.0
SHEIN Unity Form-Fitting Mock Neck Crop Top,11.4
Tie Backless Crisscross Bandana Hem Crop Knit Top,23.9
Houndstooth Print Shawl Collar Dress,5.49
Floral Print Shirred Ruched Bust Tie Backless A-line Dress,5.49
Ruched Knot Tie Side Bikini Swimsuit,16.4
SHEIN VCAY Ribbed Knit Tube Top & Biker Shorts,14.4
Puff Sleeve Ruched Blouse,10.4
Triangle Tie Side Bikini Swimsuit,11.0
EMERY ROSE Ditsy Floral Flounce Sleeve Tunic Dress,12.4
Plaid Underwire Bikini Swimsuit,10.4
SHEIN Frenchy Solid Wide Leg Pants,9.0
Single Button Raw Hem Denim Skirt,11.0
Sweetheart Neck Flounce Sleeve Bodycon Dress,20.4
SHEIN EZwear Solid Zip Front Puffer Coat,15.4
SHEIN SXY Solid Lapel Neck Single Button Blazer,13.4
PARTHEA Backless Knot Detail Asymmetrical Hem Crop Corset Tank Top,29.4
Double Crazy Plunging Neck Gigot Sleeve Sequin Fringe Dress,19.0
DAZY High Waist Washed Wide Leg Jeans,20.0
SHEIN VCAY Floral Print Lantern Sleeve Belted Dress,31.0
Letter Embroidery Thermal Lined Pullover,24.0
Street Vibes Flap Pockets Drawstring Ruched Parachute Pants,18.0
SHEIN BASICS Cotton Solid Fitted Crop Top,11.4
Solid Puff Sleeve Sweatshirt,27.0
SHEIN SXY Rib-knit Cut Out Tube Bodycon Dress,6.0
Swiss Dot Shirred Flounce Sleeve Blouse,15.4
Drop Shoulder Space Dye Sweater,7.49
EMERY ROSE Solid Criss Cross Pinafore Skirt,13.4
SHEIN EZwear Drop Shoulder Tee & Pants,22.0
DAZY Mock Neck Batwing Sleeve Tee,14.0
Letter & Cartoon Face Print Drop Shoulder Drawstring Thermal Lined Hoodie,10.0
Allover Print Ruffle Trim Dress,13.0
Swiss Dot Lace Detail Dress,8.99
Shawl Collar Double Breasted Blazer,8.0
SHEIN Frenchy Sweetheart Neck Lace Trim Ruched Bodycon Dress,30.4
Allover Floral Print Lantern Sleeve Belted Dress,24.0
SHEIN Unity Drop Shoulder Wrap Cross Top & Pants,18.4
Drop Shoulder Letter Embroidery Top,21.0
High Waist Ripped Flare Leg Jeans,16.0
Solid Cowl Neck Tee,9.0
SHEIN Solid Sheer Beach Pants,22.0
Zip Half Placket Crop Slim Tee,12.4
SHEIN VCAY Floral Print Surplice Neck A-line Dress,6.49
SHEIN PETITE Crisscross Backless Ruched Cami Bodycon Dress,7.49
SHEIN SXY Mock Neck Mesh Bodysuit Without Lingerie,12.0
SHEIN BAE Sweetheart Neck Rib Knit Crop Tee,8.0
Contrast Mesh Bodycon Dress,11.0
Rib Knit Colorblock Panel Tube Dress,6.0
Crochet Backless Halter Neck Bodycon Dress,10.1
Textured Underwire Halter Bikini Swimsuit,11.4
SHEIN EZwear V-neck Drawstring Ruched Side Dress,20.0
Slogan Graphic Drop Shoulder Oversized Tee,10.4
SHEIN PETITE One Shoulder Sequin Bodycon Dress,10.0
Drop Shoulder Cloud Pattern Cardigan,9.0
Solid Tunic Dress,23.0
Contrast Binding Dual Pocket Hooded Cardigan,20.4
Floral Halter Micro Triangle Bikini Swimsuit With Beach Skirt,11.4
EMERY ROSE Solid Tie Neck Blouse,24.0
SHEIN MOD Mock Neck Lettuce Trim Bell Sleeve Crop Tee,10.4
SHEIN Floral Print V-neck Flounce Sleeve Dress,7.49
Stone Wash High-Waisted Straight Jeans,6.49
SHEIN Tall Leaves Print Wide Leg Jeans,23.0
Vertical Striped Flounce Sleeve Tassel Tie Neck Ruffle Hem Dress,26.0
Allover Print Triangle Tie Side Bikini Swimsuit With Chain,21.9
SHEIN EZwear Buckle Detail Cut Out Front Crop Tee,18.0
SHEIN PETITE Ditsy Floral Ruched Tie Split Hem Cami Dress,8.49
SHEIN EZwear Scoop Neck Bell Sleeve Crop Tee,8.0
SHEIN VCAY Ditsy Floral Cami Dress,8.49
EMERY ROSE Allover Floral Print Split Hem Dress,3.75
Floral Jacquard Twist Bikini Swimsuit,13.0
Knot Waist Solid Jumpsuit,12.4
SHEIN SXY High Waist PU Leather Skinny Pants,12.0
Contrast Collar Pearls Beaded Dress,20.0
Square Neck Sleeveless A-line Dress,14.0
SHEIN ICON 3D Body Print Crop Tee,16.4
Fringe Trim Surplice Neck Bodycon Dress,17.4
DAZY Letter Graphic Contrast Lace 2 In 1 Tee,7.0
SHEIN Unity Frill Trim Shirred Top,22.0
Ripped Raw Hem Denim Dress,13.0
Houndstooth Print Surplice Neck Dress,11.0
Solid Rib V Wired Bikini Swimsuit,28.4
EMERY ROSE Solid Split Hem Tee,6.0
SHEIN SXY Cutout Twist Front Split Thigh Dress,11.0
Color Block Drop Shoulder Sweater,8.49
Split Hem Twist Front Tank Dress,12.4
EMERY ROSE Paisley Print Notched Neck Tunic Dress,13.8
SHEIN SXY Allover Print Tie Front Flounce Sleeve Satin Blouse,15.4
EMERY ROSE Leopard Print Asymmetrical Neck Tee,12.0
SHEIN BAE Tie Backless Crisscross Split Thigh Cami Dress,15.0
Guipure Lace Panel Batwing Sleeve Ruffle Hem Dress,7.0
SHEIN Frenchy Contrast Lace Button Back Tee,13.4
Solid Drop Shoulder Sweater,10.0
SHEIN Unity Notched Collar Single Button Pop Art Print Blazer,15.4
Letter Graphic Thermal Lined Sweatshirt,20.0
Guipure Lace Fringe Detail Batwing Sleeve Dress,12.0
SHEIN EZwear 2 Pack Halter Top,18.0
Allover Print Mock Neck Flounce Sleeve Ruched Ruffle Hem Dress,7.49
SHEIN BASICS Solid Crop Tank Top,9.75
SHEIN SXY Drop Shoulder Drawstring Thermal Hoodie & Sweatpants,4.0
Drop Shoulder Heart Pattern Sweater,27.0
Asymmetrical Neck Belted Dress,21.0
SHEIN SXY Slit Front Backless Knot Halter Top,18.0
Turtleneck Flounce Sleeve Pleated Hem Belted Dress,5.0
Patched Pocket Drop Shoulder Shirt & Knot Front Shorts,24.0
Allover Print Butterfly Sleeve Split Side Belted Dress,21.0
SHEIN Frenchy Zipper Up Slant Pocket Hooded Sleeveless Puffer Coat,16.0
Heart Pattern Flounce Sleeve Sweater,24.4
SHEIN Tall Leaves Print Wide Leg Jeans,20.0
One Shoulder Knot Solid Dress,8.49
Allover Print Triangle Tie Side Bikini Swimsuit With Chain,24.0
Zebra Striped Print Surplice Neck Belted Dress,9.0
EMERY ROSE Ruffle Armhole Floral Top,8.49
Polka Dot Ruffle Trim Knot Side Wrap Dress,22.0
SHEIN PETITE Ditsy Floral Ruched Tie Split Hem Cami Dress,7.0
Allover Print Asymmetrical Neck Bishop Sleeve Blouse,6.0
SHEIN EZwear High Waist Slant Pocket Cord Pants,8.25
SHEIN VCAY Ditsy Floral Cami Dress,28.0
SHEIN Unity Cable Knit Lantern Sleeve Sweater,27.4
Floral Print Shirred Waist Ruffle Hem Tie Backless Halter Dress,12.4
SHEIN SXY High Waist PU Leather Skinny Pants,5.0
SHEIN SXY Mesh Panel Bodycon Dress,19.0
SHEIN VCAY Geo Pattern Raw Trim Bodycon Skirt,11.7
SHEIN Modely Solid Jacquard Cami Dress,8.49
SHEIN Unity Frill Trim Shirred Top,7.75
Ditsy Floral Print Lace Trim Knot Front Cami Dress,5.0
Floral Print Flounce Sleeve Dress,13.0
Solid Rib V Wired Bikini Swimsuit,18.0
SHEIN Unity Flounce Sleeve Button Front Dress,13.0
SHEIN SXY Cutout Twist Front Split Thigh Dress,19.0
SHEIN BAE Butterfly Sleeve Sequins Fitted Dress,19.0
SHEIN ICON Western Cowgirl Colorblock Floral Print Contrast Lace Tie Front Top,19.0
Polka Dot Knot Side Wrap Dress,12.0
EMERY ROSE Knot Cuff Ruffle Hem Smock Dress,18.0
SHEIN SXY Allover Print Tie Front Flounce Sleeve Satin Blouse,11.0
EMERY ROSE Jacquard Trumpet Sleeve Knot Front Dress,11.0
SHEIN BAE Tie Backless Crisscross Split Thigh Cami Dress,15.0
Butterfly Sleeve Ruffle Hem Belted Dress,15.0
SHEIN EZwear Guipure Lace Detail Cut Out Tie Neck Lantern Sleeve Dress,9.0
SHEIN BAE Solid Ruched Tulip Hem Satin Shirt Dress,18.0
Solid Ruched Overlap Collar Sleeveless Blouse,9.49
Letter Graphic Thermal Lined Sweatshirt,8.0
SHEIN BAE Metallic Plunging High-Slit Mini Dress,19.0
SHEIN EZwear 2 Pack Halter Top,11.0
SHEIN BASICS Solid Crop Tank Top,13.4
Twist Solid Fitted Dress,15.4
SHEIN SXY Slit Front Backless Knot Halter Top,5.49
SHEIN Polka Dot Print Tie Backless Halter Top & Ruffle Hem Skirt,23.4
Patched Pocket Drop Shoulder Shirt & Knot Front Shorts,12.0
Palm Random Print Adjustable Strap Bikini Swimsuit,18.4
Hook And Eye Asymmetrical Hem Crop Tee,21.4
SHEIN VCAY Lantern Sleeve Knot Cutout Waist Chiffon Romper,7.0
SHEIN EZwear V-Neck Rib-knit Top,12.0
SHEIN BAE Sweetheart Neck Tie Back Crop Top,22.0
EMERY ROSE Solid V Neck Overall Dress Without Sweater,17.0
Geo Print Batwing Sleeve Popover Blouse,13.0
Graphic Print Belted Shirt Dress,9.49
EMERY ROSE Open Front Solid Blazer,25.4
High Waist Raw Trim Wide Leg Jeans,22.0
Shawl Collar Double Breasted Blazer,10.7
SHEIN ICON One Shoulder Cut Out Crop Top,12.0
Street Vibes Flap Pockets Drawstring Ruched Parachute Pants,14.4
Solid Zip Up Drawstring Hooded Sweatshirt,3.25
EMERY ROSE Off Shoulder Frill Trim Dress,8.25
EMERY ROSE Tropical Print Drawstring Waist Dress,9.0
SHEIN VCAY Floral Print Off Shoulder Frill Trim Dress,10.0
SHEIN SXY Lace Up Backless Hanky Hem Tube Top,10.0
Zip Half Placket Crop Slim Tee,17.4
Plaid Pattern Drop Shoulder Sweater,13.4
Letter Embroidery Thermal Lined Pullover,29.0
Mountain & Slogan Graphic Drop Shoulder Tee,13.4
Twist Front Cut Out Ruffle Hem Schiffy Cami Dress,13.4
Car And Letter Graphic Drop Shoulder Tee,14.0
SHEIN PETITE Tie Back Crop Tube Top With Mini Skirt,18.0
Cat Pattern Drop Shoulder Sweater,9.0
SHEIN BAE Solid Crossover Crop Tee,5.5
DAZY Mock Neck Batwing Sleeve Tee,8.0
SHEIN VCAY Floral Print Cut Out Back Shirred Dress,19.0
SHEIN SXY Cartoon Graphic Crop Tank Top & Biker Shorts,13.0
Colorblock Drop Shoulder Sweater,19.4
Allover Print Rib Halter Triangle Bikini Swimsuit,12.0
Rib High Waisted Bikini Swimsuit,7.0
SHEIN Unity Frill Trim Keyhole Back Blouse,19.4
Slogan Graphic Kangaroo Pocket Thermal Lined Hoodie,21.0
Ditsy Floral Tie Front Bikini Swimsuit,15.4
EMERY ROSE Paisley Print Notched Neck Tunic Dress,14.0
Knitted Slit Thigh Cover Up,18.4
EMERY ROSE Shawl Collar Single Button Ruched Cuff Blazer,8.49
SHEIN BASICS Solid Scoop Neck Bodysuit,13.0
SHEIN Unity Solid Form Fitted Tee,3.5
Textured Ring Linked Cut Out High Waisted Bikini Swimsuit,17.0
Tie Shoulder Backless See Through Cover Up,7.49
SHEIN BASICS High Neck Solid Fitted Tee,19.4
EMERY ROSE Solid Tie Neck Blouse,8.49
SHEIN SXY Mock Neck Mesh Bodysuit Without Lingerie,5.0
Solid Button Up Belted Ruched Dress,9.0
Bikinx Random Floral Sweetheart Neck Cover Up Top Without Bikini,8.0
Fringe Trim Surplice Neck Bodycon Dress,18.0
SHEIN Frenchy Contrast Lace Raglan Sleeve Blouse,13.4
SHEIN MOD Solid Deep V Neck Knotted Shoulder Ruched Satin Dress,17.4
SHEIN VCAY Tropical Print Overlap Collar Backless Slit Thigh Cami Dress,8.49
High Waist Ripped Boyfriend Jeans,11.4
SHEIN X Sierra Siler Figure Graphic Drop Shoulder Oversize Tee,7.0
Solid Drawstring Detail Thermal Lined Sweatshirt & Sweatpants,28.0
Halter Belted Ruffle Hem Floral Dress,11.0
Bikinx Floral Print Cut Out Side Bikini Swimsuit,16.0
Sweetheart Neck Drawstring Lantern Sleeve Crop Top,9.0
Keyhole Back Solid Tank Dress,21.9
SHEIN VCAY Allover Floral Print Flounce Sleeve V Neck Dress,24.0
Floral Print Flounce Sleeve Blouse,15.4
All Over Print Cami Dress,14.4
Floral Print Tie Front Bandeau Bikini Swimsuit,28.4
Joyfunear Rhinestone Satin Cami Bodycon Party Dress,8.49
SHEIN BAE Ruched Bust Split Thigh Dress,14.4
Letter And Tropical Print Oversized Tee,20.4
EMERY ROSE Solid Lantern Sleeve Belted Dress,16.0
DAZY Openwork Drop Shoulder Sweater Without Bra,8.0
SHEIN Unity Solid Chain Detail Keyhole Neckline Top,10.0
Floral & Slogan Graphic Kangaroo Pocket Drawstring Thermal Hoodie,11.4
SHEIN SXY Zip Up Thumb Holes Jacket & Leggings,19.0
Floral & Paisley Triangle Thong Bikini Swimsuit,15.4
Striped Ruffle Cap Sleeve Blouse,11.4
Bikinx Lace Up High Cut Bikini Swimsuit,6.5
ROMWE Academia Striped Pattern Drop Shoulder Sweater,14.4
Solid Push Up High Cut Bikini Swimsuit,12.0
Dalmatian Print Puff Sleeve Belted Dress,13.4
Cut Out Draped Tie Backless Halter Bodycon Dress,6.5
EMERY ROSE Ruffle Trim Solid Dress,15.4
SHEIN Frenchy Tied Backless Ruffle Hem Ditsy Floral Cami Dress,12.7
Ditsy Floral Sweetheart Neck Flounce Sleeve Top & Ruffle Hem Skirt,6.49
SHEIN VCAY Square Neck Puff Sleeve Ruffle Hem Dress,8.49
SHEIN BASICS Ribbed Knit Crop Tee,20.4
Polka Dot Shirred Cami Dress,9.75
DAZY Star Print Crop Tee,9.0
SHEIN EZwear Solid Wide Waistband Leggings,10.0
SHEIN SXY Lantern Sleeve Patent Top,27.0
Cartoon Face Print Ripped Raw Cut Denim Shorts,9.49
Cut Out Tube Bodycon Dress,19.0
Ripped Raw Hem Denim Shorts,18.0
SHEIN ICON Ruched Bust Cutout Bodycon Dress,18.0
Striped Print Cami Dress,6.0
Solid Cover Up,13.4
Solid One Knot Shoulder Asymmetrical Hem Dress,18.4
SHEIN BASICS Scoop Neck Crop Tee,15.0
Letter Graphic Thermal Sweatshirt,9.0
Polka Dot & Striped Print Notched Neck Flounce Sleeve Ruffle Hem Dress,9.49
SHEIN EZwear Crop Tank Top & Knot Front Shorts,7.0
Rib-knit Crop Tank Top & Shorts,22.4
SHEIN Unity Mesh Panel Ruched Glitter Top,7.0
SHEIN ICON 90s Bell Sleeve Tie Front Textured Sheer Top,8.49
Simplee Ruffle Hem Belted Floral Cami Dress,15.4
Ring Cut Out Front Split Thigh Tube Dress,16.0
SHEIN VCAY Ruched Bust Tie Backless Cami Dress,10.4
SHEIN PETITE Floral Print Backless Tie Front Jumpsuit,21.0
One Shoulder Rib-knit Crop Top,22.0
SHEIN BASICS 2 Pack Crop Tube Top,12.4
Solid Plicated Detail Puff Sleeve Blouse,12.4
Solid Zip Up Drawstring Drop Shoulder Thermal Lined Hoodie,12.4
Leopard Tape Bikini Swimsuit,11.0
Plunging Neck Flutter Sleeve Slit Hem Bodycon Dress,25.0
Solid Rib Bikini Panty,11.0
Rhinestone Decor Halter Triangle Bikini Swimsuit,20.4
SHEIN Tall Contrast Lace Bustier Crop Tube Top,10.0
Mock Neck Drop Shoulder Crop Sweater,13.4
1pc Hanky Hem Rhinestone Fishnet Dress,8.49
Solid Frill Trim Blouse,11.0
Solid Cross Back One Piece Swimsuit,28.0
SHEIN VCAY High Waist Wide Leg Pants,14.0
SHEIN Unity Plaid Print Scoop Neck Belted Dress,16.4
SHEIN VCAY Criss Cross Backless Ruffle Hem Cami Dress,10.1
EMERY ROSE Lantern Sleeve Belted Tunic Dress,13.4
SHEIN SXY Solid Ruched Bodycon Dress,23.0
SHEIN VCAY Ruched Bust Cutout Detail Bodycon Dress,14.0
SHEIN SXY Solid Stand Collar Garter Detail Dress,14.4
Plant Print Cut Out Tie Back Lantern Sleeve Dress,7.0
SHEIN Unity Plaid Belted Self-Tie Mini Dress,15.0
3sets Solid Tank Top & Shorts,7.0
Shirred Bodice Ruffle Hem Dress,5.5
Floral Print Ruffle Trim High Low Hem Dress,11.2
SHEIN Unity Solid Corduroy Overall Dress Without Top,19.4
Solid Zipper Back A-line Dress,6.0
Scallop Trim Drop Shoulder Sweater,13.0
Geo Print Shirred Waist Dress,7.25
SHEIN SXY Solid Unitard Tank Jumpsuit,12.0
Striped Pattern Backless Halter Knit Top,16.4
Random Floral Print High Waist Bikini Swimsuit,20.0
Letter Graphic Drop Shoulder Pullover & Sweatpants,11.4
ROMWE Sweetness Cherry Lace Cami Top,14.0
SHEIN VCAY Twist Front Cutout Eyelet Embroidery Top,8.25
Solid Ruffle Trim Sleeveless Dress,16.4
Drop Shoulder Shirt & Pants,10.0
SHEIN SXY High Low Flounce Sleeve Shirt & Frill Trim Halter Top & Shorts,8.0
Joyfunear Rhinestone Satin Cami Bodycon Party Dress,7.0
Striped Pocket Fitted Dress,8.0
High Waist High Stretch Leather Look Skinny Jeans,10.5
Solid Bikini Panty,8.25
Allover Floral Print Ruffle Hem Bishop Sleeve Dress,18.0
Plain Contrast Mesh High Waisted Bikini Swimsuit,13.4
SHEIN SXY Hook & Eye Sweetheart Neck Bandana Hem Crop Blouse,7.49
Surplice Neck Lantern Sleeve Split Hem Sequins Dress,7.49
High Waist Solid Pleated Skirt,19.4
Ditsy Floral Tie Neck Bishop Sleeve Layered Dress,19.6
Glamaker Twist Front Ruched Satin Dress,12.4
Pom-pom Trim Bikini Shorts,21.0
Solid Flounce Sleeve Smock Dress,15.4
SHEIN SXY Drop Shoulder Drawstring Thermal Hoodie & Sweatpants,5.0
SHEIN Unity Square Neck Puff Sleeve Tie Back Chiffon Dress,20.0
Schiffy Tie Front Bikini Swimsuit,24.0
Marled Knitted Cover Up,10.0
SHEIN VCAY Allover Floral Print Twist Front Halter Dress,16.4
Allover Floral Print Shirred Off Shoulder Ruffle Hem Dress,9.0
Tropical Print Cold Shoulder Belted Dress,28.4
3pack Floral Print Halter Triangle Bikini Swimsuit & Beach Skirt,11.4
Floral Embroidery Mesh Shirred Puff Sleeve Dress,16.4
Tie Front Crop Top & Plicated Detail Shorts,24.0
Ditsy Floral Ruched Bodycon Dress,9.0
Floral Print Puff Sleeve Shirred Layered Hem Dress,11.4
EMERY ROSE Solid V Neck Overall Dress Without Sweater,7.0
SHEIN MOD Asymmetrical Waist Slit Hem Denim Skirt,19.4
DAZY Batwing Sleeve Duster Cardigan,11.0
Contrast Binding Tie Side Bikini Bottom,7.49
Plain Textured Bikini Swimsuit,8.0
Vertical Striped Flounce Sleeve Tassel Tie Neck Ruffle Hem Dress,18.0
Leopard Print Bishop Sleeve Chiffon Shirt,5.0
SHEIN VCAY Tied Backless Halter Open Knit Crop Top,8.0
Solid Tunic Dress,6.49
SHEIN EZwear Scoop Neck Tank Top and Track Shorts,18.0
Solid Drop Shoulder Sweater,3.75
Cross Wrap Tie Backless Halter Bodycon Dress,14.0
Mock Neck Allover Print Dress,13.0
SHEIN SXY Cartoon Graphic Crop Tank Top & Biker Shorts,3.75
SHEIN SXY Ruched Slit Hem Mesh Bodycon Dress,19.0
4pcs Solid Tank Top,23.4
Ditsy Floral Print Ruffle Hem Dress,7.0
Button Through Drop Shoulder Shirt & Drawstring Waist Shorts,7.0
Leopard Print Ruffle Tie Backless Asymmetrical Hem Halter Dress,15.4
Neon Blue Contrast Trim One Shoulder High Waist Bikini Swimsuit,11.0
Solid Textured Bikini Bottom,9.49
Heart Knit Drop Shoulder Sweater,8.49
SHEIN Unity Tie Front Split Thigh Dress,18.0
SHEIN Unity Slit Hem Longline Blouse & Wide Leg Pants Set,17.4
Solid Drawstring Waist Sweatpants,5.49
Ditsy Floral Knot Shoulder Ruffle Hem Dress,18.0
Flounce Sleeve Belted Sequins Dress,7.0
SHEIN PETITE Solid Plunging Neck Cami Bodysuit,9.25
SHEIN BASICS Solid Crop Tank Top,22.0
SHEIN Unity Solid High Waist Leggings,12.4
DAZY Star Print Drop Shoulder Hoodie,9.49
SHEIN BAE High Waist PU Leather Pants,33.4
SHEIN EZwear Solid Wideband Waist Flare Leg Pants,15.0
SHEIN SXY Strap Detail Backless PU Leather Bodycon Dress,8.0
Fringe Trim Bodycon Sequin Cami Dress,4.0
Tropical Print Split Thigh Cami Dress,23.4
DAZY Solid Mock Neck Ribbed Knit Tank Top,16.4
Plaid Print Button Detail Fitted Dress,15.4
Faux Pearl Decor Knot Side Sheer Cover Up Skirt Without Bikini,19.0
Dalmatian Print Puff Sleeve Belted Dress,8.49
Gingham Puff Sleeve Ruffle Hem Smock Dress,15.0
Knot Back Lantern Sleeve Ruffle Hem Dress,12.4
SHEIN PETITE Ruched Tube Bodycon Dress,14.4
Basketball & Letter Graphic Thermal Lined Sweatshirt,7.0
SHEIN VCAY Tied Shoulder Cami Dress,13.0
SHEIN Frenchy Contrast Lace Raglan Sleeve Blouse,9.0
Floral Print Frill Trim Tie Front Dress,26.0
SHEIN Unity High Waist Solid Pleated Skirt,21.0
Ruffle Hem Shirred Bodice Solid Tube Dress,11.0
EMERY ROSE Allover Floral Print Ruched Bust Dress,8.49
SHEIN VCAY Ditsy Floral Lantern Sleeve Cut Out Tie Back Crop Blouse,17.0
Striped Drop Shoulder Zipper Front Sweater,8.49
Joyfunear Rhinestone Satin Cami Bodycon Party Dress,24.0
Letter Graphic Drop Shoulder Tee,16.0
Lapel Neck Single Button Blazer,5.0
SHEIN PETITE Rhinestone Detail Backless Crop Tee,20.6
Solid Open Front Blazer,5.49
EMERY ROSE Ruffle Trim Solid Dress,19.0
Zipper Fly Ripped Detail Wide Leg Jeans,5.49
Floral Print Zip Side Split Thigh Tube Dress,19.0
SHEIN EZwear Waffle Knit Crop Top,5.49
Solid Pearl Beaded A-line Dress,16.0
Satin Jacquard Tie Back Crop Bandana Tube Top,13.0
SHEIN Frenchy Solid Ribbed Knit Tank Top,16.4
Allover Print Puff Sleeve A-line Dress,16.0
V Neck Drop Shoulder Sweater,5.0
SHEIN VCAY Allover Floral Print Twist Front Halter Dress,10.0
One Shoulder Knot Side Wrap Dress,20.4
SHEIN EZwear V-neck Drawstring Ruched Side Dress,6.0
SHEIN SXY Plunging Neck Twist Front Tee,27.0
SHEIN Frenchy Solid Wide Leg Pants,5.0
MIUSOL Ruched Zip Back Split Hem Business Slim Fitted Dress,13.4
SHEIN ICON Asymmetrical Neck Sheer Mesh Top Without Bra,13.8
Tropical Print Surplice Neck Shirred Waist Dress,7.75
Solid Crop Tee,16.0
Plunging Neck Flutter Sleeve Slit Hem Bodycon Dress,7.0
Color Block Drop Shoulder Sweater,13.0
PARTHEA Zip Back Tube Mesh Top,18.0
SHEIN ICON Contrast Piping Drawstring Waist Pants,19.0
SHEIN Unity Solid Sweetheart Neck Crop Tee,8.49
SHEIN VCAY Floral Print Batwing Sleeve Belted Jumpsuit,14.0
Floral Button Front Puff Sleeve Ruffle Hem Dress,10.0
DAZY Off Shoulder Slim Fit Tee,17.0
SHEIN EZwear Cow Print High-Rise Flare Pants,18.4
SHEIN SXY Cut Out Tie Back Halter Dress,15.0
DAZY Batwing Sleeve Ribbed Knit Duster Cardigan,7.49
SHEIN EZwear Pop Art Print Drop Shoulder Shirt,8.49
SHEIN Frenchy Sweetheart Neck Lace Trim Ruched Bodycon Dress,6.0
SHEIN BIZwear Wide Waistband Houndstooth Print Leggings,16.0
High Neck Slim Fit Basic Tee,13.0
Twist Solid Fitted Dress,16.0
SHEIN EZwear Marled Knit Solid Tee,18.0
SHEIN Frenchy Dalmatian Print Flounce Sleeve Dress,8.5
Drawstring Side Color Block Bodycon Tank Dress,13.4
Leopard Print Keyhole Back Bishop Sleeve Blouse,10.5
Mock Neck Drop Shoulder Crop Sweater,16.4
Dalmatian Print Notched Neckline Ruffle Hem Smock Dress,9.49
SHEIN Unity Contrast Rhinestone Mesh Lantern Sleeve Dress,11.0
Tropical & Letter Graphic Drop Shoulder Tee,17.0
Swiss Dot Ruched Bust Ruffle Hem Cami Dress,10.4
Shawl Collar Single Button Plicated Detail Blazer,18.0
Contrast Binding Keyhole Neckline Butterfly Sleeve Blouse,13.4
Swiss Dot Batwing Sleeve Belted Dress,12.0
SHEIN SXY Mock Neck Slit Back Polka Dot Dress,17.4
Ditsy Floral Print Slit Hem Belted Cami Dress,11.4
Polka Dot Print Lantern Sleeve Smock Dress,20.0
Random Allover Print Ring Linked Bikini Swimsuit,8.49
Shawl Collar Pleated Hem Belted Dress,5.49
Schiffy Tie Front Bikini Swimsuit,24.0
EMERY ROSE Floral Print Cold Shoulder Dress,14.4
Shawl Collar Double Breasted Blazer,9.25
SHEIN SXY Sheer Mesh Top Without Bra,8.0
Frill Trim Layered Hem Cami Dress,18.0
EMERY ROSE Floral Print Mock Neck Belted Dress,12.4
SHEIN BIZwear High Neck Form Fitted Top,19.0
Pearls Beaded Tassel Trim Drop Shoulder Sweater,7.49
Graphic & Striped Frill Pearls Split Hem Batwing Sleeve Dress,19.0
O-ring Detail Cutout Front Ruched Tube Dress,6.49
Shirred Tie Back Ruffle Hem Dress,17.4
SHEIN SXY Floral Print Stand Neck Mesh Dress,19.0
SHEIN VCAY Solid Crop Top & Ditsy Floral Print Wrap Skirt Set,14.0
SHEIN Unity Form-Fitting Mock Neck Top,13.4
SHEIN VCAY Swiss Dot Frill Trim Bardot Blouse,12.4
3pcs Letter Graphic Drop Shoulder Tee,17.4
Solid Asymmetrical Neck Fitted Dress,17.0
SHEIN ICON Asymmetrical Neck Asymmetrical Hem Top & Drawstring Bodycon Skirt,7.0
DAZY Rib-knit Split Hem Pants,8.49
Eyelet Embroidery Knot Front Top & Drawstring Split Hem Skirt,25.0
SHEIN PETITE Solid Bodycon Dress,23.4
Ditsy Floral Knot Straps Split Thigh Cami Dress,12.4
Floral Print Tie Neck Smock Dress,10.4
SHEIN VCAY Layered Ruffle Trim Crop Top & Skirt Set,13.4
Frill Trim Tie Backless Dress,12.0
SHEIN Unity Square Neck Mermaid Hem Bodycon Dress,19.4
EMERY ROSE Paisley Print Notched Neck Tunic Dress,10.0
Car & Letter Graphic Drop Shoulder Oversized Tee,10.0
Mock Neck Contrast Lace Belted Dress,20.0
EMERY ROSE Floral Print Butterfly Sleeve Peplum Blouse,21.4
Simplee Floral Print Backless Wrap Split Slip Dress,25.0
SHEIN VCAY Ditsy Floral Criss-cross Backless Split Cami Dress,21.0
DAZY High Waist Fold Pleated Pants,8.49
4pcs Scoop Neck Ribbed Knit Tee,6.0
Graphic Print Belted Shirt Dress,15.4
EMERY ROSE Paisley Scarf Print Cami Dress,13.4
Heart Print Round Neck Tee,4.0
Dalmatian Print Lantern Sleeve Ruffle Hem Smock Dress,23.0
SHEIN VCAY Plunging Neck Tied Open Back Tropical Dress,11.4
SHEIN Floral Print V-neck Flounce Sleeve Dress,7.49
SHEIN BASICS Solid Crop Tube Top,7.0
EMERY ROSE High Waist Contrast Dobby Mesh Leggings,13.4
Letter & Cartoon Graphic Drop Shoulder Oversized Tee,15.0
SHEIN BAE Contrast Sequin Notched Neckline Blouse,14.4
SHEIN Modely Contrast Mesh A-line Dress Without Belt,10.4
Faux Pearl Decor Knot Side Sheer Cover Up Skirt Without Bikini,20.0
SHEIN Modely Collared Floral Print Belted Shirt Dress,19.0
Heart Pattern Raglan Sleeve Sweater,16.4
SHEIN Modely Geo Print Batwing Sleeve Dress Without Belt,9.49
Allover Print Button Up Satin Shirt,11.0
SHEIN Tall Striped Print Button Up Belted Shirt Dress,12.0
All Over Print Cami Dress,7.49
SHEIN PETITE Ruched Tube Bodycon Dress,12.0
Drawstring Side Cover Up Shorts,12.0
SHEIN VCAY Tied Shoulder Cami Dress,6.0
Floral Print Frill Trim Tie Front Dress,23.4
EMERY ROSE High Waist Contrast Dobby Mesh Leggings,25.4
Ruffle Hem Shirred Bodice Solid Tube Dress,13.0
SHEIN Unity Lapel Neck Single Breasted Blazer & Pants,11.4
SHEIN VCAY Ditsy Floral Lantern Sleeve Cut Out Tie Back Crop Blouse,15.4
Striped Drop Shoulder Zipper Front Sweater,24.4
Basketball & Letter Graphic Thermal Lined Sweatshirt,12.0
Lapel Neck Sequin Blazer,14.0
Letter Graphic Drop Shoulder Tee,7.0
One Shoulder Batwing Sleeve Dress,11.4
SHEIN PETITE Rhinestone Detail Backless Crop Tee,18.0
SHEIN EZwear Tie Dye Drop Shoulder Super Crop Hoodie & Cami Dress,5.0
Joyfunear Rhinestone Satin Cami Bodycon Party Dress,14.4
EMERY ROSE Mock Neck Lace Bodysuit Without Camisole,14.0
SHEIN EZwear Tie Dye Wideband Waist Leggings,9.0
Zipper Fly Ripped Detail Wide Leg Jeans,17.4
SHEIN EZwear Waffle Knit Crop Top,6.25
Allover Print Lantern Sleeve Wrap Hem Satin Dress,22.0
Satin Jacquard Tie Back Crop Bandana Tube Top,19.0
SHEIN BIZwear Shawl Collar Wrap Knot Side Pleated Hem Blazer Dress,12.0
SHEIN VCAY Allover Floral Print Twist Front Halter Dress,20.0
EMERY ROSE Floral Print Ruffle Sleeve Dress,14.0
SHEIN BAE Shawl Collar Wrap Knot Side Satin Blouse,15.0
SHEIN SXY Plunging Neck Twist Front Tee,18.4
EMERY ROSE Notched Sequins Tape Colorblock Top,11.0
Solid Wrap Knot Side Dress,13.0
SHEIN ICON Asymmetrical Neck Sheer Mesh Top Without Bra,8.49
One Shoulder Rib-knit Crop Top,15.4
Striped Plunging Neck A-line Dress,13.4
Solid Crop Tee,24.0
SHEIN Belle One Shoulder Split Hem Dress,20.0
EMERY ROSE Allover Print Tee Dress,4.0
PARTHEA Zip Back Tube Mesh Top,12.4
EMERY ROSE Solid Puff Sleeve Dress,11.4
SHEIN Unity Solid Sweetheart Neck Crop Tee,7.0
Solid Button Up Belted Ruched Dress,24.4
Floral Button Front Puff Sleeve Ruffle Hem Dress,12.0
Fringe Trim Bodycon Sequin Cami Dress,24.4
SHEIN EZwear Newspaper Print Mock Neck Crop Tee,8.0
DAZY Off Shoulder Slim Fit Tee,17.4
SHEIN Unity Allover Print Tee,8.49
EMERY ROSE Roll-up Sleeve Button Front Smock Dress,17.0
